show_id,type,title,director,cast,country,date_added,release_year,rating,duration,listed_in,description
s2497,Movie,Honeytrap,Rebecca Johnson,"Jessica Sula, Lucien Laviscount, Ntonga Mwanza, Naomi Ryan, Danielle Vitalis, Lauren Johns, Tosin Cole, Savannah Gordon-Liburd, Modupe Adeyeye",United Kingdom,"May 20, 2020",2014,TV-MA,94 min,"Dramas, Independent Movies","New to London, a naive and desperate teenager tries to fit in but instead becomes tragically implicated in a merciless world of gang violence."
s2517,Movie,The End,Mohammed Alhmly,"Mohamed El Hemaly, Abdulla Al-khudr, Ghadeer Zayid, Heba El Dorry, Abdulaziz Al-mesallam, Meshal Al-farhan, Meshal Al-Mujibel, Ibrahim Al-Sheikhly, Souad al-Husseini, Soliman Elyassin",Kuwait,"May 17, 2020",2019,TV-MA,97 min,"Action & Adventure, Comedies, International Movies","A wrongly accused man is pursued by a dogged investigator in this action-comedy featuring car chases, dark humor and more than a few vampires."
s2539,Movie,Wedy Atkalam,Sadeq Behbehani,"Abdulmohsen Al-Qaffas, Jamal Alradhan, Jassim Al Nabhan, Layla Abdullah, Khaled Al-Buraiki",Kuwait,"May 14, 2020",2018,TV-PG,72 min,"Comedies, Dramas, International Movies","A socially conscious film director struggles with his career as he faces numerous obstacles, including his social media-friendly significant other."
s2544,Movie,Unbreakable Kimmy Schmidt: Kimmy vs. the Reverend,Claire Scanlon,"Ellie Kemper, Jane Krakowski, Tituss Burgess, Carol Kane, Jon Hamm, Daniel Radcliffe, Lauren Adams, Sara Chase, Sol Miranda, Amy Sedaris, Mike Carlsen, Dylan Gelula, Chris Parnell, Heidi Gardner, Jack McBrayer, Zak Orth, Fred Armisen, Johnny Knoxville",United States,"May 12, 2020",2020,TV-14,190 min,Comedies,"It's an interactive Kimmy special! Kimmy's getting married, but first she has to foil the Reverend's evil plot. It's your move: What should she do next?"
s2550,Movie,John Henry,Will Forbes,"Terry Crews, Ludacris, Jamila Velazquez, J.J. Soria, Ken Foree, Daffany Clark, Kimberly Hébert-Gregory, Tyler Alvarez",United States,"May 9, 2020",2020,R,92 min,"Dramas, Thrillers",A reformed LA gang member upends his peaceful new life when he steps in to protect two young immigrants from his violent former leader.
s2551,Movie,18 Presents,Francesco Amato,"Vittoria Puccini, Benedetta Porcaroli, Edoardo Leo, Sara Lazzaro, Marco Messeri, Betty Pedrazzi, Alessandro Giallocosta, Filippo Gili, Giacomo Rosselli",Italy,"May 8, 2020",2020,TV-MA,114 min,"Dramas, Independent Movies, International Movies",A pregnant mother with terminal cancer leaves behind 18 sentimental gifts for her unborn daughter to receive every birthday until she reaches womanhood.
s2557,Movie,In Paradox,Hamad AlSarraf,"Faisal Al Omairi, Jafra Younes, Samr Ismaiel, Ghanim Alzerlli, Jaber Jokhadar, Nawar Youssef, Jassim Al Nabhan, Fayez Kazak, Nancy Khoury, Jamal Hamdan",Kuwait,"May 7, 2020",2019,TV-14,94 min,"International Movies, Sci-Fi & Fantasy, Thrillers","On the run from assailants, a man desperately seeks to take control of his strange memories before they consume his life — and sanity."
s2562,Movie,Jerry Seinfeld: 23 Hours To Kill,Joe DeMaio,Jerry Seinfeld,United States,"May 5, 2020",2020,TV-PG,61 min,Stand-Up Comedy,"Jerry Seinfeld takes the stage in New York and tackles talking vs. texting, bad buffets vs. so-called ""great"" restaurants and the magic of Pop Tarts."
s2567,Movie,Bennett's War,Alex Ranarivelo,"Michael Roark, Trace Adkins, Ali Afshar, Allison Paige, Tony Panterra, Brando Eaton, Hunter Clowdus, Michael King",United States,"May 2, 2020",2019,PG-13,94 min,"Dramas, Sports Movies",A medically discharged soldier attempts an improbable return to motorcycle racing to win enough prize money to save his father's farm.
s2568,Movie,Death Can Wait,Fernando Ayllón,"Ricardo Quevedo, Nelson Polanía, Liss Pereira, Brian Moreno, Ana Cristina Botero, Jairo Ordóñez, Luis Alberto Saavedra, Blanca Ligia Franco, Marianne Schaller Romero, Shirley Marulanda",Colombia,"May 2, 2020",2020,TV-14,91 min,"Comedies, International Movies","After learning he may die soon, a modest accountant pulls off a shady money scheme and heads to Europe, where he's faced with a life-or-death situation."
s2571,Movie,Lady Driver,Shaun Paul Piccinino,"Grace Van Dien, Sean Patrick Flanery, Christina Moore, Casper Van Dien, Amanda Detmer, John Ducey, Matthew Joel Kranyak, David Gridley",United States,"May 2, 2020",2019,PG,104 min,"Dramas, Sports Movies","When a rebellious teen searches for her unknown roots, it leads her to the sport of dirt track racing and a discovery she didn't expect."
s2572,Movie,Mike Birbiglia: My Girlfriend's Boyfriend,Seth Barrish,Mike Birbiglia,United States,"May 2, 2020",2013,TV-14,76 min,Stand-Up Comedy,"On this painfully honest but hilarious journey, Birbiglia struggles to find reason in an area where it may be impossible to find: love."
s2574,Movie,The Stand at Paxton County,Brett Hedlund,"Jacqueline Toboni, Michael O'Neill, Tyler Jacob Moore, Christopher McDonald, Sean O'Bryan, Blake Sheldon, Zoe Kanters, Greg Perrow, Tanner Thomason",United States,"May 2, 2020",2020,R,103 min,"Dramas, Independent Movies, Thrillers",A military veteran comes home to find her father harassed by a sheriff intent on confiscating the livestock on their ranch under shady pretenses.
s2577,Movie,All Day and a Night,Joe Robert Cole,"Jeffrey Wright, Ashton Sanders, Regina Taylor, Yahya Abdul-Mateen II, Isaiah John, Kelly Jenrette, Shakira Ja-nai Paye",United States,"May 1, 2020",2020,R,122 min,"Dramas, Independent Movies","While serving life in prison, a young man looks back at the people, the circumstances and the system that set him on the path toward his crime."
s2579,Movie,Get In,Olivier Abbou,"Adama Niane, Stéphane Caillard, Paul Hamy, Eddy Leduc, Hubert Delattre, Matthieu Kacou, Charlotte Geiger, Christopher Fataki","France, Belgium","May 1, 2020",2019,TV-MA,98 min,"International Movies, Thrillers","When he returns from vacation and finds his home occupied by squatters, a family man is caught in a conflict that escalates to terrifying heights."
s2580,Movie,Go! Go! Cory Carson: The Chrissy,"Alex Woo, Stanley Moore","Alan C. Lim, Maisie Benson, Kerry Gudjohnsen, Terrance Smith, Paul Killam, Omari Weaver, Ella Joy Ballesteros, Smith Foreman, Stanley Moore",United States,"May 1, 2020",2020,TV-Y,42 min,Children & Family Movies,"The Carson kids win a talent show with a dance that Cory created. But when ""The Chrissy"" catches on, his little sister gets all of the attention."
s2583,Movie,Madagascar: Escape 2 Africa,"Eric Darnell, Tom McGrath","Ben Stiller, Chris Rock, David Schwimmer, Jada Pinkett Smith, Sacha Baron Cohen, Cedric the Entertainer, Andy Richter, Bernie Mac, Alec Baldwin, Sherri Shepherd",United States,"May 1, 2020",2008,PG,91 min,"Children & Family Movies, Comedies","A botched rescue strands Alex the lion and his companions in Africa. Sadly, Alex discovers he has little in common with the locals."
s2585,Movie,Material,Craig Freimond,"Vincent Ebrahim, Riaad Moosa, Joey Rasdien, Denise Newman, Krijay Govender, Nik Rabinowitz, Zakeeya Patel, Carishma Basday, Royston Stoffels, Mel Miller",South Africa,"May 1, 2020",2012,TV-14,94 min,"Comedies, Dramas, International Movies","A dutiful son must hide his pursuit of stand-up comedy from his staunch father, who expects him to inherit his store and uphold their Muslim beliefs."
s2592,Movie,The Half Of It,Alice Wu,"Leah Lewis, Daniel Diemer, Alexxis Lemire, Wolfgang Novogratz, Collin Chou, Becky Ann Baker, Enrique Murciano, Macintyre Dixon, Catherine Curtin",United States,"May 1, 2020",2020,PG-13,105 min,"Comedies, Dramas, LGBTQ Movies","When smart but cash-strapped teen Ellie Chu agrees to write a love letter for a jock, she doesn't expect to become his friend — or fall for his crush."
s2597,Movie,What a Girl Wants,Dennie Gordon,"Amanda Bynes, Colin Firth, Kelly Preston, Eileen Atkins, Anna Chancellor, Jonathan Pryce, Oliver James, Christina Cole","United States, United Kingdom","May 1, 2020",2003,PG,105 min,"Children & Family Movies, Comedies","In search of the father she's never met, the daughter of a bohemian American woman heads to Europe and finds that her dad is an uptight politician."
s2598,Movie,Dangerous Lies,Michael M. Scott,"Camila Mendes, Jessie T. Usher, Jamie Chung, Cam Gigandet, Sasha Alexander, Elliott Gould",United States,"April 30, 2020",2020,TV-14,97 min,Thrillers,"A broke caregiver unexpectedly inherits her patient's estate, but dark secrets swirl around her newfound wealth, tangling her in deceit and danger."
s2625,Movie,5Gang,Matei Dima,"Andrei Selaru, Dorian Popa, Julia Marcan, Ana Radu, Cosmin Nedelcu, Diana Condurache, Andrei Gavril, Luca Bogdan",Romania,"April 27, 2020",2019,TV-14,96 min,"Comedies, International Movies","To keep the band together, Selly tries to earn money by making an appearance at the birthday party of a mobster's daughter — until he gets kidnapped."
s2635,Movie,The Artist,Michel Hazanavicius,"Jean Dujardin, Bérénice Bejo, John Goodman, James Cromwell, Penelope Ann Miller, Missi Pyle, Beth Grant, Ed Lauter, Joel Murray, Elizabeth Tulloch, Ken Davitian, Malcolm McDowell","France, Belgium, United States","April 25, 2020",2011,PG-13,101 min,"Comedies, Dramas, Independent Movies","Winner of five Oscars, this black-and-white silent film follows the romance between a silent-era legend on a downward spiral and a rising starlet."
s2651,Movie,Time to Hunt,Yoon Sung-hyun,"Lee Je-hoon, Ahn Jae-hong, Choi Woo-shik, Park Jeong-min, Park Hae-soo",South Korea,"April 23, 2020",2020,TV-MA,135 min,"International Movies, Thrillers","Wanting to leave their dystopian world behind for a faraway paradise, three outlaws plot a money heist — and draw the attention of a vicious killer."
s2654,Movie,The Plagues of Breslau,Patryk Vega,"Małgorzata Kożuchowska, Daria Widawska, Katarzyna Bujakiewicz, Maria Dejmek, Andrzej Grabowski, Ewa Kasprzyk, Jacek Beler, Wojciech Kalinowski, Igor Kujawski, Iwona Bielska, Tomasz Oświeciński",Poland,"April 22, 2020",2018,TV-MA,94 min,"International Movies, Thrillers","After a body is found sewn inside a cow hide, a Wrocław detective discovers a killer is recreating an 18th-century ""plague"" of criminal punishments."
s2657,Movie,The Willoughbys,Kris Pearn,"Will Forte, Maya Rudolph, Ricky Gervais, Alessia Cara, Terry Crews, Jane Krakowski, Martin Short, Seán Cullen","Canada, United States, United Kingdom","April 22, 2020",2020,PG,92 min,"Children & Family Movies, Comedies",Four siblings with horribly selfish parents hatch a plan to get rid of them for good and form a perfectly imperfect family of their own.
s2669,Movie,Earth and Blood,Julien Leclercq,"Sami Bouajila, Eriq Ebouaney, Samy Seghir, Sofia Lesaffre","France, Belgium","April 17, 2020",2020,TV-MA,81 min,"Dramas, International Movies, Thrillers",A sawmill owner and his teenage daughter become tangled in a deadly feud when a drug dealer stashes stolen cocaine on their remote property.
s2672,Movie,Rising High,Cüneyt Kaya,"David Kross, Frederick Lau, Janina Uhse, Anne Schäfer, Sophia Thomalla",Germany,"April 17, 2020",2020,TV-MA,95 min,"Dramas, International Movies","Ready to do anything to get rich, a young man upends the Berlin property market with his shady pal, till the good times threaten to destroy it all."
s2673,Movie,Sergio,Greg Barker,"Wagner Moura, Ana de Armas, Brían F. O'Byrne, Clemens Schick, Bradley Whitford",United States,"April 17, 2020",2020,R,119 min,"Dramas, Independent Movies","Passions, ideals and bitter realities collide as charismatic UN diplomat Sergio Vieira de Mello becomes trapped in a life-threatening situation in Iraq."
s2675,Movie,Alelí,Leticia Jorge Romero,"Néstor Guzzini, Mirella Pascual, Cristina Morán, Romina Peluffo, Laila Reyes Silberberg, Pablo Tate, Gerónimo Pizzanelli, Georgina Yankelevich, Julio Icasuriaga, Carla Moscatelli","Uruguay, Argentina","April 16, 2020",2019,TV-MA,88 min,"Comedies, Dramas, International Movies","Mourning their father's death, a dysfunctional trio of siblings must face selling their beloved childhood beach house — and dealing with each other."
s2678,Movie,"Hail, Caesar!","Ethan Coen, Joel Coen","Josh Brolin, George Clooney, Scarlett Johansson, Alden Ehrenreich, Ralph Fiennes, Tilda Swinton, Channing Tatum, Frances McDormand, Jonah Hill, Veronica Osorio, Heather Goldenhersh, Alison Pill","United States, United Kingdom, Japan","April 16, 2020",2016,PG-13,106 min,Comedies,"When a major star is kidnapped from a movie set, a hard-charging but overwhelmed studio boss sets out to find the actor and save the film."
s2680,Movie,Maurício Meirelles: Generating Chaos,Diego Pignataro,Maurício Meirelles,Brazil,"April 16, 2020",2020,TV-MA,63 min,Stand-Up Comedy,"Comedian Maurício Meirelles explores his chaotic mind with scathingly funny views on family, prejudices, turtles and more in this stand-up special."
s2681,Movie,Puerto Ricans in Paris,Ian Edelman,"Luis Guzmán, Edgar Garcia, Alice Taglioni, Rosie Perez, Miriam Shor, Frédéric Anscombre, Rosario Dawson, Julie Ferrier, Michaël Cohen, Ravi Patel",United States,"April 16, 2020",2015,R,82 min,Comedies,New York police detectives Luis and Eddie experience culture shock and adventure when they head to Paris to track down a stolen couture handbag.
s2687,Movie,Chris D'Elia: No Pain,Matt D'Elia,Chris D'Elia,United States,"April 14, 2020",2020,TV-MA,55 min,Stand-Up Comedy,Chris D'Elia takes the stage in Minneapolis to offer his thoughts on everything from self-censorship to problematic dolphins to lame mutant powers.
s2691,Movie,Code 8,Jeff Chan,"Robbie Amell, Stephen Amell, Sung Kang, Kari Matchett, Greg Bryk, Aaron Abrams, Kyla Kane",Canada,"April 11, 2020",2019,TV-MA,98 min,"Action & Adventure, Independent Movies, International Movies","In a city where super-powered people are ostracized, an earnest day laborer considers using his outlawed abilities for money to save his sick mother."
s2695,Movie,School Life,"Grand Corps Malade, Mehdi Idir","Zita Hanrot, Liam Pierron, Soufiane Guerrab, Ibrahim Dramé, Moussa Mansaly, Moryfère Camara, Alban Ivanov, Gaspard Gévin-Hié, Antoine Reinartz, Mahamadou Sangaré, Redouane Bougheraba, Hocine Mokando, Aboudou Sacko",France,"April 10, 2020",2019,TV-MA,112 min,"Comedies, Dramas, International Movies","In one of the poorest areas of Paris, a school counselor devotes herself to working with disadvantaged students, while facing challenges of her own."
s2698,Movie,Tigertail,Alan Yang,"Tzi Ma, Christine Ko, Hong-Chi Lee, Hayden Szeto, Kunjue Li, Fiona Fu, James Saito, Joan Chen",United States,"April 10, 2020",2020,PG,91 min,Dramas,A man reflects on the lost love of his youth and his long-ago journey from Taiwan to America as he begins to reconnect with his estranged daughter.
s2701,Movie,Born Beautiful,Perci Intalan,"Martin del Rosario, Lou Veloso, Chai Fonacier, Kiko Matos, Akihiro Blanco, Paolo Ballesteros",Philippines,"April 8, 2020",2019,TV-MA,96 min,"Comedies, Dramas, International Movies","After her best friend dies, Barbs attempts to rediscover herself until love leaves her true identity — and heart — in question."
s2702,Movie,The Last Airbender,M. Night Shyamalan,"Noah Ringer, Dev Patel, Nicola Peltz, Jackson Rathbone, Shaun Toub, Aasif Mandvi, Cliff Curtis, Seychelle Gabriel, Jessica Andres, Keong Sim, Summer Bishil, Francis Guinan, Katharine Houghton, Damon Gupton",United States,"April 8, 2020",2010,PG,104 min,"Action & Adventure, Children & Family Movies, Sci-Fi & Fantasy","In a world ravaged by the Fire nation's aggression toward the peaceful Air, Water and Earth nations, a young boy holds the key to restoring peace."
s2703,Movie,Tiffany Haddish: She Ready! From the Hood To Hollywood!,Chris Robinson,Tiffany Haddish,United States,"April 7, 2020",2017,TV-MA,66 min,Stand-Up Comedy,Comedic breakout Tiffany Haddish delivers a riotous stand-up ripe with the unpretentious and filthy tales of her meteoric rise to stardom.
s2704,Movie,Mine 9,Eddie Mensore,"Terry Serpico, Kevin Sizemore, Mark Ashworth, Clint James, Drew Starkey, Erin Elizabeth Burns",United States,"April 6, 2020",2019,TV-MA,83 min,"Dramas, Independent Movies",A methane explosion leaves a group of miners trapped two miles deep into the earth with a small oxygen supply and desperate for any means of survival.
s2705,Movie,The Florida Project,Sean Baker,"Brooklynn Prince, Bria Vinaite, Willem Dafoe, Christopher Rivera, Valeria Cotto, Macon Blair, Caleb Landry Jones",United States,"April 6, 2020",2017,R,111 min,"Dramas, Independent Movies",A mischievous 6-year-old finds the magic in her own circumstances while living with her troubled mom in a budget motel near Disney World.
s2707,Movie,The Killing of a Sacred Deer,Yorgos Lanthimos,"Colin Farrell, Nicole Kidman, Barry Keoghan, Alicia Silverstone, Raffey Cassidy, Sunny Suljic, Bill Camp, Drew Logan, Barry G. Bernson, Denise Dal Vera, Herb Caillouet","Ireland, United Kingdom","April 5, 2020",2017,R,121 min,"Dramas, Independent Movies, Thrillers",A surgeon's carefully curated life edges toward disaster when a troubled teenage boy with mysterious motives begins to impose himself on his family.
s2710,Movie,Coffee & Kareem,Michael Dowse,"Ed Helms, Taraji P. Henson, Terrence Little Gardenhigh, Betty Gilpin",United States,"April 3, 2020",2020,TV-MA,88 min,"Action & Adventure, Comedies",An inept Detroit cop must team up with his girlfriend's foul-mouthed young son when their first crack at bonding time uncovers a criminal conspiracy.
s2713,Movie,The Death of Stalin,Armando Iannucci,"Steve Buscemi, Simon Russell Beale, Paddy Considine, Rupert Friend, Jason Isaacs, Michael Palin, Andrea Riseborough, Jeffrey Tambor, Olga Kurylenko, Paul Chahidi","United Kingdom, France, Belgium, Canada, United States","April 3, 2020",2017,R,107 min,"Comedies, Dramas, Independent Movies",The death of Russian dictator Joseph Stalin throws the Soviet Union into comic chaos as his ambitious but addled ministers maneuver to succeed him.
s2715,Movie,Violet Evergarden: Eternity and the Auto Memory Doll,Haruka Fujita,"Yui Ishikawa, Minako Kotobuki, Aoi Yuki",Japan,"April 2, 2020",2019,TV-PG,91 min,"Anime Features, International Movies, Sci-Fi & Fantasy",A lonely young woman feels trapped at her all girls' school. But metal hands and heartfelt letters warm her heart when Violet becomes her tutor.
s2720,Movie,David Batra: Elefanten i rummet,"David Batra, Jon Rudberg",David Batra,Sweden,"April 1, 2020",2020,TV-MA,77 min,Stand-Up Comedy,Swedish comedian David Batra gets personal as he playfully details the perks and pitfalls of being married to a recently resigned political leader.
s2745,Movie,The Little Vampire,"Richard Claus, Karsten Kiilerich","Matthew Marsh, Rasmus Hardiker, Miriam Margolyes, Tim Pigott-Smith, Alice Krige, Amy Saville, Joseph Kloska, Diane Wilson, Phoebe Givron-Taylor, Jim Carter, Sven De Ridder","Netherlands, Germany, Denmark, United Kingdom","April 1, 2020",2017,TV-G,83 min,Children & Family Movies,An American kid obsessed with the undead befriends and offers to help a young vampire whose family is being targeted by a merciless vampire hunter.
s2755,Movie,Greater,David Hunt,"Neal McDonough, Leslie Easterbrook, Christopher Severio, Michael Parks, Nick Searcy, Peter Gray Lewis, Fredric Lehne, M.C. Gainey, Texas Battle, Josh Emerson",United States,"March 31, 2020",2016,PG,131 min,"Children & Family Movies, Dramas, Sports Movies",Faith and determination transform a talentless football player at the University of Arkansas into an All-American in this inspiring true story.
s2758,Movie,Pretty Little Stalker,Sam Irvin,"Nicky Whelan, Ashley Rickards, Parker Mack, Jesse Hutch, Sierra McCormick, Heather Morris, Jason Cermak, Kourtney Hansen, Jane Harber, Cory Hart, Kim DeJesus",United States,"March 31, 2020",2018,TV-14,84 min,Thrillers,"When a self-help writer's advice goes wrong, she finds herself in the crosshairs of an obsessive young woman with a thirst for vengeance."
s2763,Movie,Rogue Warfare,Mike Gunther,"Will Yun Lee, Jermaine Love, Rory Markham, Bertrand-Xavier Corbi, Katie Keene, Fernando Chien, Gina DeCesare, Michael Blalock, Chris Mulkey, Stephen Lang",United States,"March 28, 2020",2019,R,103 min,Action & Adventure,An elite international squad of uniquely skilled special forces is assembled to combat a rising underground terrorist threat in the Middle East.
s2764,Movie,Dragons: Rescue Riders: Hunt for the Golden Dragon,"TJ Sullivan, Greg Rankin","Noah Kaye Bentley, Brennley Brown, Zach Callison, Nicolas Cantu, Skai Jackson, Marsai Martin, Andre Robinson, Carlos Alazraqui, Jeff Bennett, Grey Griffin, Mary Elizabeth McGlynn",United States,"March 27, 2020",2020,TV-Y,46 min,"Children & Family Movies, Comedies","It's the treasure hunt of a lifetime for the Rescue Riders, who must race to find a precious golden dragon egg and protect it from evil pirates."
s2769,Movie,The Decline,Patrice Laliberté,"Guillaume Laurin, Marie-Evelyne Lessard, Réal Bossé, Marc-André Grondin, Marc Beaupré, Marilyn Castonguay, Guillaume Cyr, Isabelle Giroux, Juliette Maxyme Proulx",Canada,"March 27, 2020",2020,TV-MA,83 min,"Action & Adventure, International Movies",An accident at a remote training camp leaves a group of survivalists bitterly divided — and caught in a brutal fight for their lives.
s2771,Movie,True: Wuzzle Wegg Day,"Todd Kauffman, Mark Thornton","Michela Luci, Jamie Watson, Eric Peterson, Anna Claire Bartlam, Nicolas Aqui, Cory Doran, Julie Lemieux",Canada,"March 27, 2020",2020,TV-Y,24 min,Children & Family Movies,"Spring has sprung in Rainbow City, and Wuzzle Wegg Day is right around the corner! But Bartleby's convinced that a Wegg-stealing monster is on the loose."
s2774,Movie,Willy and the Guardians of the Lake: Tales from the Lakeside Winter Adventure,Zsolt Pálfi,"Csongor Szalay, Anna Kubik, Sári Vida, András Faragó, Róbert Bolla",Hungary,"March 27, 2020",2019,TV-Y,72 min,Children & Family Movies,"As winter approaches the lake, a common threat rattles the Verdies and Grimps as Willy Whistle looks to seize his chance to become a guardian."
s2781,Movie,Curtiz,Tamas Yvan Topolanszky,"Ferenc Lengyel, Evelin Dobos, Declan Hannigan, Scott Alexander Young, József Gyabronka, Nikolett Barabas, Yan Feldman, Rafael Feldman, Christopher Krieg, Andrew Hefler, Lili Bordán",Hungary,"March 25, 2020",2018,TV-MA,99 min,"Dramas, International Movies","Driven and arrogant, film director Michael Curtiz deals with studio politics and family drama during the troubled production of ""Casablanca"" in 1942."
s2783,Movie,Tom Segura: Ball Hog,Rami Hachache,Tom Segura,United States,"March 24, 2020",2020,TV-MA,70 min,Stand-Up Comedy,"Tom Segura scores laughs with uncomfortably candid stories about mothers, fathers, following your dreams — and other things you'd rather not think about."
s2797,Movie,Ultras,Francesco Lettieri,"Aniello Arena, Antonia Truppo, Ciro Nacca, Simone Borelli, Daniele Vicorito, Salvatore Pelliccia",Italy,"March 20, 2020",2020,TV-MA,109 min,"Dramas, International Movies, Sports Movies",An aging soccer fanatic faces down the reality of his past while struggling to give himself and a young follower very different futures.
s2799,Movie,3022,John Suits,"Omar Epps, Kate Walsh, Miranda Cosgrove, Angus Macfadyen, Jorja Fox, Enver Gjokaj, Haaz Sleiman",United States,"March 19, 2020",2019,R,91 min,"Independent Movies, Sci-Fi & Fantasy, Thrillers","Stranded when the Earth is suddenly destroyed in a mysterious cataclysm, the astronauts aboard a marooned space station slowly lose their minds."
s2800,Movie,Altered Carbon: Resleeved,"Takeru Nakajima, Yoshiyuki Okada","Tatsuhisa Suzuki, Rina Satou, Ayaka Asai, Jouji Nakata, Kenji Yamauchi, Kanehira Yamamoto, Koji Ishii","Japan, United States","March 19, 2020",2020,TV-MA,75 min,"Action & Adventure, Anime Features, International Movies","On the planet Latimer, Takeshi Kovacs must protect a tattooist while investigating the death of a yakuza boss alongside a no-nonsense CTAC."
s2801,Movie,Masameer - The Movie,Malik Nejer,"Malik Nejer, Shahad Alahmari, Abdulaziz Almuzaini, Yousef Aldakheel",Saudi Arabia,"March 19, 2020",2020,TV-14,100 min,"Comedies, International Movies",A young girl passionate about AI sets out to make an impact as three friends become crime-fighting superheroes. Based on the hit animated web series.
s2807,Movie,Bert Kreischer: Hey Big Boy,Jeff Tomsic,Bert Kreischer,United States,"March 17, 2020",2020,TV-MA,62 min,Stand-Up Comedy,"Ever the stand-up party animal, comic Bert Kreischer riffs on parenting and family life, being a gun and pet owner, his dad discovering pot, and more."
s2810,Movie,Search Party,Scot Armstrong,"T.J. Miller, Adam Pally, Thomas Middleditch, Lance Reddick, Shannon Woodward, Alison Brie, Krysten Ritter, Jason Mantzoukas",United States,"March 16, 2020",2014,R,93 min,Comedies,"Two guys hope to reunite their friend with his runaway bride, unaware that he's been carjacked, stripped and stranded in the Mexican desert."
s2818,Movie,Baby Mamas,Stephanie Zwane,"Salamina Mosese, Kay Smith, Thembisa Mdoda, Dineo Ranaka, Sthembiso Khoza, Khaya Mthembu, Jonathan Boynton-Lee, Nicholas Nkuna, Donovan Pietersen, Pamela Nomvete",South Africa,"March 13, 2020",2018,TV-14,98 min,"Comedies, Dramas, International Movies","From surprise news to relationship blues, four coworkers in different stages of motherhood unite to support each other in their struggles with men."
s2820,Movie,Go Karts,Owen Trevor,"William Lodder, Anastasia Bampos, Darius Amarfio-Jefferson, Richard Roxburgh, Frances O'Connor, Dan Wyllie, Cooper van Grootel, Damian de Montemas, Adam T. Perkins",Australia,"March 13, 2020",2020,TV-PG,103 min,"Children & Family Movies, Dramas","A fearless teen leans into the rush of high-speed go-kart racing, backed by good friends — and a surly ex-driver who becomes his coach."
