show_id,type,title,director,cast,country,date_added,release_year,rating,duration,listed_in,description
s4365,Movie,My Little Pony Friendship Is Magic: Best Gift Ever,"Denny Lu, Mike Myhre","Tara Strong, Andrea Libman, Ashleigh Ball, Cathy Weseluck, Tabitha St. Germain, John de Lancie, Sam Vincent, Garry Chalk",United States,"November 25, 2018",2018,TV-Y,44 min,Children & Family Movies,"The ponies get in the spirit of the holidays by drawing names for a gift exchange, then race around Equestria in search of the perfect presents."
s4370,Movie,The Christmas Chronicles,Clay Kaytis,"Kurt Russell, Darby Camp, Judah Lewis, Kimberly Williams-Paisley, Oliver Hudson, Lamorne Morris, Martin Roach",United States,"November 22, 2018",2018,TV-PG,104 min,"Children & Family Movies, Comedies","After accidentally crashing Santa's sleigh, a brother and sister pull an all-nighter to save Christmas with a savvy, straight-talking St. Nick."
s4378,Movie,Trevor Noah: Son of Patricia,David Paul Meyer,Trevor Noah,United States,"November 20, 2018",2018,TV-MA,64 min,Stand-Up Comedy,"""Daily Show"" host Trevor Noah touches on tacos, runaway snakes, camping, racism immunity and lessons he learned from his mother in this comedy special."
s4384,Movie,Nothing to Hide,Fred Cavayé,"Bérénice Bejo, Suzanne Clément, Stéphane De Groodt, Vincent Elbaz, Grégory Gadebois, Doria Tillier, Roschdy Zem, Fleur Fitoussi","France, Belgium","November 16, 2018",2018,TV-MA,94 min,"Comedies, Dramas, International Movies","To spice up a dinner party, old friends agree to share every private message that pops up on their phones – with disastrous results."
s4386,Movie,The Ballad of Buster Scruggs,"Joel Coen, Ethan Coen","Liam Neeson, James Franco, Tim Blake Nelson, Tom Waits, Zoe Kazan, Brendan Gleeson",United States,"November 16, 2018",2018,R,133 min,"Comedies, Dramas","Ranging from absurd to profound, these Western vignettes from the Coen brothers follow the adventures of outlaws and settlers on the American frontier."
s4398,Movie,BuyBust,Erik Matti,"Anne Curtis, Brandon Vera, Victor Neri, Arjo Atayde, Levi Ignacio, Alex Calleja, Lao Rodriguez, Joross Gamboa, Ricky Pascua, Nonie Buencamino",Philippines,"November 13, 2018",2018,TV-MA,128 min,"Action & Adventure, International Movies","In a mazelike Manila slum, at war with incensed civilians and a brutal cartel, special agent Nina Manigan must fight her way through one fierce night."
s4403,Movie,Lommbock,Christian Zübert,"Lucas Gregorowicz, Moritz Bleibtreu, Louis Hofmann, Wotan Wilke Möhring, Alexandra Neldel, Melanie Winigir, Mavie Hörbiger, Dar Salim, Elmar Wepper, Antoine Monot Jr.",Germany,"November 9, 2018",2017,TV-MA,106 min,"Comedies, International Movies","After finding love in drug-free Dubai, Stefan returns to Germany to grab documents for his wedding. But old buddy Kai's bad habits complicate things."
s4405,Movie,Outlaw King,David Mackenzie,"Chris Pine, Aaron Taylor-Johnson, Florence Pugh, Billy Howle, Sam Spruell, Tony Curran, Callan Mulvey, James Cosmo, Stephen Dillane","United Kingdom, United States","November 9, 2018",2018,R,122 min,"Action & Adventure, Dramas","In 14th-century Scotland, Robert the Bruce claims the crown and leads a fierce uprising to win back the country's independence from English rule."
s4527,Movie,Pulang,Kabir Bhatia,"Puteri Aishah, Remy Ishak, Alvin Wong",Malaysia,"October 8, 2018",2018,TV-14,119 min,"Action & Adventure, Dramas, International Movies","Thom tells her grandson about his grandfather, a sailor who left 61 years ago to seek his fortune, and asks him to find out what happened to her spouse."
s4534,Movie,Private Life,Tamara Jenkins,"Paul Giamatti, Kathryn Hahn, Kayli Carter, Molly Shannon, John Carroll Lynch, Denis O'Hare, Desmin Borges, Tracee Chimo, Siobhan Fallon Hogan, Emily Robinson",United States,"October 5, 2018",2018,R,124 min,"Comedies, Dramas, Independent Movies","Struggling to conceive, a couple in their 40s are almost out of options – until a sliver of hope arrives in the form of their visiting step-niece."
s4540,Movie,Death Race: Beyond Anarchy,Don Michael Paul,"Zach McGowan, Danny Glover, Frederick Koehler, Danny Trejo, Christine Marzano, Cassie Clare, Yennis Cheung, Lucy Aarden","United States, Bulgaria","October 2, 2018",2017,R,111 min,Action & Adventure,"An ex-racecar driver is sent to a barbaric prison where, to get pardoned, he must defeat the inmate known as Frankenstein in a lethal ""Death Race."""
s4545,Movie,"Monty Python Live (Mostly): One Down, Five to Go",Eric Idle,"John Cleese, Terry Gilliam, Eric Idle, Terry Jones, Michael Palin",United Kingdom,"October 2, 2018",2014,TV-MA,137 min,Comedies,"Live from London in a sold-out final show, surviving members of the British comedy troupe reprise old roles and break out in irreverent song and dance."
s4548,Movie,Monty Python: Live at The Hollywood Bowl,"Terry Hughes, Ian MacNaughton","Graham Chapman, John Cleese, Terry Gilliam, Eric Idle, Terry Jones, Michael Palin, Neil Innes, Carol Cleveland",United Kingdom,"October 2, 2018",1982,R,80 min,Comedies,"Film clips and Terry Gilliam animations feature in this live-to-tape performance of greatest hits, including ""Travel Agent"" and ""Solo Wrestling."""
s4553,Movie,Monty Python's Life of Brian,Terry Jones,"Graham Chapman, John Cleese, Terry Gilliam, Eric Idle, Terry Jones, Michael Palin, Terence Bayler, Carol Cleveland",United Kingdom,"October 2, 2018",1979,R,94 min,"Classic Movies, Comedies, Cult Movies","Born in a stable in Judea, Brian grows up to join a group of anti-Roman zealots, but his fate keeps getting confused with that of a certain carpenter."
s4555,Movie,Parrot Sketch Not Included: Twenty Years of Monty Python,Ian MacNaughton,"Steve Martin, John Cleese, Graham Chapman, Terry Gilliam, Eric Idle, Terry Jones, Michael Palin, Carol Cleveland, Connie Booth",United Kingdom,"October 2, 2018",1989,TV-14,72 min,Comedies,"Presented by Steve Martin, this anthology draws from “Flying Circus” and “Fliegender Zirkus” to mark the 20th anniversary of the TV series."
s4558,Movie,A Witches' Ball,Justin G. Dyck,"Morgan Neundorf, Karen Slater, Loukia Ioannou, Will Ennis, Renee Stein, Keith Cooper, Paul Mason, Lisa Scenna, Ashley Rogan",Canada,"October 1, 2018",2017,PG,91 min,Children & Family Movies,"Beatrix can't wait to be inducted as a witch, but an unfortunate incident threatens to take her pending title away if she doesn't act fast."
s4590,Movie,My Little Pony Equestria Girls: Forgotten Friendship,Ishi Rudell,"Ashleigh Ball, Andrea Libman, Rebecca Shoichet, Tabitha St. Germain, Tara Strong, Nicole Oliver",United States,"October 1, 2018",2018,TV-Y,44 min,Children & Family Movies,School yearbook editor Sunset Shimmer has suddenly been erased from the memories of her best friends and must find out how to fix this.
s4643,Movie,The Land of Steady Habits,Nicole Holofcener,"Ben Mendelsohn, Edie Falco, Connie Britton, Thomas Mann, Bill Camp, Elizabeth Marvel, Charlie Tahan, Michael Gaston, Josh Pais",United States,"September 14, 2018",2018,TV-MA,98 min,"Comedies, Dramas, Independent Movies","After leaving his wife and his job to find happiness, Anders begins a clumsy, heartbreaking quest to reassemble the pieces of his fractured life."
s4647,Movie,On My Skin,Alessio Cremonini,"Alessandro Borghi, Jasmine Trinca, Milvia Marigliano, Max Tortora",Italy,"September 12, 2018",2018,TV-MA,100 min,"Dramas, International Movies","Arrested in Rome for a drug-related offense, Stefano Cucchi endures a harrowing week in custody that changes his family forever. Based on true events."
s4650,Movie,The Resistance Banker,Joram Lürsen,"Barry Atsma, Jacob Derwig, Pierre Bokma, Jaap Spijkers, Raymond Thiry, Fockeline Ouwerkerk, Matteo van der Grijn, Jochum ten Haaf, Peter Jordan, Götz Schubert",Netherlands,"September 11, 2018",2018,TV-MA,123 min,"Dramas, International Movies","Risking his family and future, a banker in occupied Amsterdam slows the Nazi war machine by creating an underground bank to fund the resistance."
s4660,Movie,The Most Assassinated Woman in the World,Franck Ribière,"Anna Mouglalis, Niels Schneider, André Wilms, Michel Fau, Sissi Duparc, Jean-Michel Balthazar, Julie Recoing, Eric Godon, Maya Coline, Constance Dollé","Belgium, United Kingdom, United States","September 7, 2018",2018,TV-MA,102 min,"Dramas, International Movies, Thrillers","In 1930s Paris, an actress famous for her gory death scenes at the Grand Guignol Theater contends with a mysterious stalker and ghosts from her past."
s4662,Movie,The Debt Collector,Jesse V. Johnson,"Scott Adkins, Louis Mandylor, Vladimir Kulich, Michael Paré, Rachel Brann, Selina Lo, Tony Todd","United Kingdom, United States","September 3, 2018",2018,TV-MA,96 min,Action & Adventure,"A broke martial arts instructor takes a side gig with a mobster, who pairs him with a veteran thug for a weekend of fisticuffs-fueled debt collection."
s4666,Movie,Carbon,Olivier Marchal,"Benoît Magimel, Gringe, Idir Chender, Laura Smet, Michaël Youn, Dani, Patrick Catalifo, Gérard Depardieu","France, Belgium","September 1, 2018",2017,TV-MA,104 min,"Dramas, International Movies, Thrillers","On the verge of losing his business, an entrepreneur launches a carbon tax scam that thrusts him into a web of criminals, intrigue and murder."
s4672,Movie,Sparring,Samuel Jouy,"Mathieu Kassovitz, Olivia Merilahti, Souleymane M'Baye, Billie Blain, Malik Bine, Zakariya Gouram, Jolente De Keersmaeker, Lyes Salem, Ali Labidi, David Saracino",France,"September 1, 2018",2017,TV-MA,94 min,"Dramas, International Movies, Sports Movies",A middle-aged boxer with a mixed record becomes a champion's sparring partner while dreaming of one last chance to end his career with a victory.
s4684,Movie,Maria Bamford: The Special Special Special,Jordan Brady,"Maria Bamford, Wayne Federman, Jackie Kashian",United States,"August 25, 2018",2012,TV-MA,50 min,Stand-Up Comedy,"Spend an evening with gleeful, oh-so-awkward Maria Bamford via her cozy, shot-at-home comedy special, which has a two-person audience: her parents."
s4687,Movie,One Last Shot,Mike Clattenburg,"Robb Wells, John Paul Tremblay, John Dunsworth",Canada,"August 24, 2018",1998,TV-MA,31 min,Comedies,"In this low-budget short film, two best buddies meet up for a night of booze-fueled fun before one of them moves to Vancouver."
s4700,Movie,Yoo Byung Jae: Discomfort Zone,Y. Joon Chung,Yoo Byung Jae,South Korea,"August 17, 2018",2018,TV-MA,54 min,Stand-Up Comedy,Daring comedian Yoo Byung-jae connects criticism he's received from the general public to some of the most touchy issues in current Korean society.
s4707,Movie,The Package,Jake Szymanski,"Daniel Doheny, Geraldine Viswanathan, Luke Spencer Roberts, Eduardo Franco, Sadie Calvano",United States,"August 10, 2018",2018,TV-MA,95 min,Comedies,"After their buddy suffers an unfortunate accident during spring break, four pals risk everything – including their dignity – to make him whole again."
s4719,Movie,Like Father,Lauren Miller Rogen,"Kristen Bell, Kelsey Grammer, Seth Rogen, Paul W. Downs, Zach Appelman, Leonard Ouzts, Blaire Brooks, Anthony Laciura, Mary Looram, Brett Gelman",United States,"August 3, 2018",2018,TV-MA,104 min,"Comedies, Dramas","After she's left at the altar, a workaholic advertising executive ends up on her Caribbean honeymoon cruise with her estranged father."
s4741,Movie,Invisible,Pablo Giorgelli,"Mora Arenillas, Mara Bestelli, Diego Cremonesi","Argentina, France","August 1, 2018",2017,TV-MA,87 min,"Dramas, Independent Movies, International Movies","After learning she's pregnant, a teen grapples with the consequences while trying to go about her life as if nothing has changed."
s4746,Movie,Da Kath & Kim Code,Ted Emery,"Jane Turner, Gina Riley, Glenn Robbins, Peter Rowsthorn, Magda Szubanski",Australia,"July 28, 2018",2005,TV-PG,82 min,Movies,"Kath and Kel's union is tested by Michael Bublé, daughter Kim tries pole dancing, pal Sharon finds love online, and a stalker lurks amid Yuletide cheer."
s4747,Movie,Kath & Kimderella,Ted Emery,"Jane Turner, Gina Riley, Magda Szubanski, Glenn Robbins, Peter Rowsthorn, Rob Sitch, Richard E. Grant, Barry Humphries, Erin Mullally, Jessica De Gouw",Australia,"July 28, 2018",2012,TV-14,86 min,Comedies,"Chipper baby boomer Kath, diva daughter Kim and hapless pal Sharon visit Papilloma, Italy, where a royal romance and knockoff fashions await."
s4752,Movie,Extinction,Ben Young,"Michael Peña, Lizzy Caplan, Israel Broussard, Mike Colter, Emma Booth, Lex Shrapnel, Erica Tremblay, Lilly Aspell",United States,"July 27, 2018",2018,TV-MA,95 min,"Action & Adventure, Dramas, Sci-Fi & Fantasy","Plagued by dreams of an alien invasion, a family man faces his worst nightmare when an extraterrestrial force begins exterminating Earth's inhabitants."
s4757,Movie,Iliza Shlesinger: Elder Millennial,Steve Paley,Iliza Shlesinger,United States,"July 24, 2018",2018,TV-MA,72 min,Stand-Up Comedy,"Newly engaged comic Iliza Shlesinger dives into undeniable truths about life at age 35, the insanity of the road traveled and what's to come."
s4770,Movie,GODZILLA City on the Edge of Battle,"Kobun Shizuno, Hiroyuki Seshita","Mamoru Miyano, Takahiro Sakurai, Kana Hanazawa, Tomokazu Sugita, Yuki Kaji, Junichi Suwabe, Reina Ueda, Ari Ozawa, Daisuke Ono, Kenta Miyake, Kenyu Horiuchi, Kazuya Nakai, Kazuhiro Yamaji",Japan,"July 18, 2018",2018,TV-14,101 min,"Action & Adventure, Anime Features, International Movies","On Earth, Haruo and his companions make contact with the indigenous Houtua tribe. To defeat Godzilla, they set out for the old Mechagodzilla facility."
s4771,Movie,Going for Gold,Clay Glen,"Kelli Berglund, Emily Morris, Terry Rogers, Jess Kuss, Jo Stone, Elysia Markou, Daisy Anderson, Ruth Natalie Fallon, Henry Turczynowicz, Martha Lott",Australia,"July 15, 2018",2018,TV-G,88 min,"Children & Family Movies, Dramas, International Movies","After moving to Australia, an American teen convinces her new friends to form a cheer squad and take on their biggest rivals in competition."
s4774,Movie,How It Ends,David M. Rosenthal,"Theo James, Forest Whitaker, Kat Graham, Nicole Ari Parker, Mark O'Brien, Grace Dove",United States,"July 13, 2018",2018,TV-MA,113 min,"Action & Adventure, Sci-Fi & Fantasy","When a mysterious disaster turns the country into a war zone, a young lawyer heads west with his future father-in-law to find his pregnant fiancée."
s4775,Movie,Jim Jefferies: This Is Me Now,Scott Zabielski,Jim Jefferies,United States,"July 13, 2018",2018,TV-MA,71 min,Stand-Up Comedy,"The gleefully irreverent Jefferies skewers ""grabby"" celebrities, political hypocrisy and his own ill-advised career moves in a brash stand-up special."
s4783,Movie,The Legacy of a Whitetail Deer Hunter,Jody Hill,"Josh Brolin, Danny McBride, Montana Jordan, Scoot McNairy, Carrie Coon",United States,"July 6, 2018",2018,TV-14,83 min,"Action & Adventure, Comedies, Dramas",A star of hunting videos strives to bond with his 12-year-old son on a wilderness trip but learns familial connections can't be forced.
s4785,Movie,White Fang,Alexandre Espigares,"Nick Offerman, Rashida Jones, Paul Giamatti, Eddie Spears, David Boat, Sean Kenin, Raquel Antonia, Daniel Hagen, Stephen Kramer Glickman, William Calvert, Jason Grasl, Armando Riesco","France, Luxembourg, United States","July 6, 2018",2018,TV-PG,88 min,"Children & Family Movies, Dramas",A loyal wolfdog's curiosity leads him on the adventure of a lifetime while serving a series of three distinctly different masters.
s4786,Movie,Sommore: Chandelier Status,Kevin Layne,Sommore,United States,"July 4, 2018",2013,TV-MA,77 min,Stand-Up Comedy,"Luminous funnywoman Sommore wows Miami with her unique take on body modification, Internet sex, the world of celebrities and more."
s4787,Movie,Felipe Esparza: They're Not Going to Laugh at You,Scott L. Montoya,Felipe Esparza,United States,"July 3, 2018",2012,TV-MA,58 min,Stand-Up Comedy,"""Last Comic Standing"" winner Felipe Esparza runs riot in his first comedy special with his wry comments on life as a wild man from East Los Angeles."
s4788,Movie,Joan Rivers: Don't Start with Me,Scott L. Montoya,Joan Rivers,United States,"July 3, 2018",2012,TV-MA,69 min,Stand-Up Comedy,"At 78, Joan Rivers has no interest in slowing down, and no one's immune from her caustic barbs in this stand-up special."
s4792,Movie,Bo Burnham: what.,"Bo Burnham, Christopher Storer",Bo Burnham,United States,"July 1, 2018",2013,TV-MA,60 min,Stand-Up Comedy,Left brain and right brain duke it out – and ultimately belt out a melody – in stand-up comedian Bo Burnham's quick and clever one-man show.
s4795,Movie,Duck Butter,Miguel Arteta,"Alia Shawkat, Laia Costa, Mae Whitman, Hong Chau, Kate Berlant, Lindsay Burdge, Kumail Nanjiani, Mark Duplass, Jay Duplass, Jenny O'Hara",United States,"July 1, 2018",2018,TV-MA,94 min,"Dramas, Independent Movies, LGBTQ Movies","Wary of dishonesty in relationships, two young women embark on a 24-hour experiment on intimacy, but their romance flounders as the clock winds down."
s4804,Movie,Bill Burr: You People Are All the Same,Jay Karas,Bill Burr,United States,"June 30, 2018",2012,TV-MA,69 min,Stand-Up Comedy,"Funnyman Bill Burr takes the stage to uncork a profanity-laced, incisive routine that pokes fun at plastic surgery, reality TV, gold diggers and more."
s4807,Movie,Calibre,Matt Palmer,"Jack Lowden, Martin McCann, Tony Curran, Ian Pirie, Cameron Jack",United Kingdom,"June 29, 2018",2018,TV-MA,101 min,"Dramas, International Movies, Thrillers",Two lifelong friends on a hunting trip in Scotland find their nerves – and their morals – ruthlessly tested after a harrowing turn of events.
s4813,Movie,TAU,Federico D'Alessandro,"Maika Monroe, Ed Skrein, Gary Oldman",United States,"June 29, 2018",2018,R,98 min,"Sci-Fi & Fantasy, Thrillers","Kidnapped by an inventor who uses her as a test subject to perfect his robotic AI, a street-smart young woman tries to escape her high-tech prison."
s4815,Movie,W. Kamau Bell: Private School Negro,Shannon Hartman,W. Kamau Bell,United States,"June 26, 2018",2018,TV-MA,66 min,Stand-Up Comedy,"Comedian W. Kamau Bell muses on parenting in the Trump era, ""free speech"" dustups, woke children's TV and his fear of going off the grid."
s4817,Movie,Expelled from Paradise,Seiji Mizushima,"Rie Kugimiya, Wendee Lee, Shinichiro Miki, Steve Blum, Hiroshi Kamiya, Johnny Yong Bosch",Japan,"June 25, 2018",2014,TV-MA,103 min,"Action & Adventure, Anime Features, Sci-Fi & Fantasy","In the wake of a global catastrophe, the human survivors are ""uploaded"" into a cyber network, but someone or something is infiltrating the system."
s4820,Movie,Brain on Fire,Gerard Barrett,"Chloë Grace Moretz, Thomas Mann, Richard Armitage, Jenny Slate, Carrie-Anne Moss, Tyler Perry, Alex Zahara","United States, Canada, Ireland","June 22, 2018",2016,PG-13,89 min,"Dramas, Independent Movies, International Movies","Stricken with seizures, psychosis and memory loss, a young New York Post reporter visits doctor after doctor in search of an elusive diagnosis."
s4824,Movie,Hannah Gadsby: Nanette,"Madeleine Parry, Jon Olb",Hannah Gadsby,Australia,"June 19, 2018",2018,TV-MA,70 min,Stand-Up Comedy,"Australian comic Hannah Gadsby reshapes standard stand-up by pairing punchlines with personal revelations on gender, sexuality and childhood turmoil."
s4827,Movie,Maktub,Oded Raz,"Guy Amir, Hanan Savyon, Itzik Cohen, Igal Naor",Israel,"June 15, 2018",2018,TV-MA,106 min,"Comedies, International Movies","After surviving a bomb attack, two low-level mobsters in Jerusalem change their ways and set about making strangers' Wailing Wall prayers come true."
s4831,Movie,The last hour,Eduardo Mendoza de Echave,"Pietro Sibille, Nidia Bermejo, Toño Vega, Tommy Párraga, Fausto Molina, Katerina D'Onofrio, Haysen Percovich, Emilram Cossío, Sandro Calderón, Tony Dulzaidez","Chile, Peru","June 15, 2018",2017,TV-MA,119 min,"Dramas, International Movies","In this compelling true story, two Peruvian detectives go undercover to locate and capture the elusive leader of the Shining Path guerrilla army."
s4834,Movie,Alex Strangelove,Craig Johnson,"Daniel Doheny, Madeline Weinstein, Antonio Marziale, Daniel Zolghadri, Annie Q., Nik Dodani, Fred Hechinger, Kathryn Erbe, Isabella Amara, Sophie Faulkenberry",United States,"June 8, 2018",2018,TV-MA,100 min,"Comedies, Dramas, Independent Movies",High school senior Alex Truelove's plan to lose his virginity to lovable girlfriend Claire goes awry when he meets the equally lovable Elliot.
s4835,Movie,Ali's Wedding,Jeffrey Walker,"Osamah Sami, Don Hany, Helana Sawires, Frances Duca, Majid Shokor, Rodney Afif, Ghazi Alkinani, Ryan Corr",Australia,"June 8, 2018",2018,TV-MA,110 min,"Comedies, Independent Movies, International Movies","After telling a white lie that spins out of control, the son of an Iraqi-born cleric in Melbourne becomes torn between family duty and his own heart."
s4841,Movie,Bad Genius,Nattawut Poonpiriya,"Chutimon Chuengcharoensukying, Chanon Santinatornkul, Teeradon Supapunpinyo, Eisaya Hosuwan, Thaneth Warakulnukroh, Sarinrat Thomas, Ego Mikitas, Pasin Kuansataporn, Sahajak Boonthanakit, Kanjana Vinaipanid",Thailand,"June 1, 2018",2017,TV-MA,130 min,"Dramas, International Movies, Thrillers",A top student gets pulled into a cheating racket with increasingly higher risks and even higher rewards. But she may lose much more than she gains.
s4855,Movie,Tig Notaro Happy To Be Here,Tig Notaro,Tig Notaro,United States,"May 22, 2018",2018,TV-14,58 min,Stand-Up Comedy,"Comedian Tig Notaro unleashes her inner prankster in a playful stand-up special packed with funny anecdotes, parenting confessions and more."
s4859,Movie,Katt Williams: American Hustle (The Movie),Brit McAdams,"Katt Williams, Da Brat, Snoop Dogg, Tamala Jones, Jeremy Piven, Ludacris, Melanie Comarcho, Red Grant, Alphonso Mcauley, Damaine Radcliff, Taran Killam",United States,"May 17, 2018",2007,TV-MA,89 min,Stand-Up Comedy,"An aspiring actor leaves Hollywood and takes to the road to do stand-up after he's cast in a series of increasingly stereotypical ""black"" roles."
s4862,Movie,Lupin the 3rd: The Castle of Cagliostro: Special Edition,Hayao Miyazaki,"Yasuo Yamada, Kiyoshi Kobayashi, Eiko Masuyama, Makio Inoue, Goro Naya, Sumi Shimamoto, Taro Ishida, Kohei Miyauchi, Ichiro Nagai",Japan,"May 15, 2018",1979,PG-13,100 min,"Action & Adventure, Anime Features, Classic Movies","Lupin, his sidekick, Jigen, and the samurai warrior Goemon set out to take over an evil counterfeit operation at Count Cagliostro's fortress."
s4865,Movie,Spivak,"Anthony Abrams, Adam Larson Broder","Michael Bacall, Maggie Lawson, Elden Henson, Robert Kazinsky, Mark Webber, Chloe Wepper",United States,"May 12, 2018",2017,TV-MA,92 min,"Comedies, Independent Movies",Struggling writer Wally Spivak is stuck in a rut – until he meets an engaged couple and starts to see life in a whole new way.
s4871,Movie,Hari Kondabolu: Warn Your Relatives,Bobcat Goldthwait,Hari Kondabolu,United States,"May 8, 2018",2018,TV-MA,67 min,Stand-Up Comedy,"Hari Kondabolu breaks down identity politics, celebrity encounters, his mango obsession and more in an unpredictable stand-up comedy special."
s4872,Movie,My Fuhrer,Dani Levy,"Helge Schneider, Ulrich Mühe, Sylvester Groth, Adriana Altaras, Stefan Kurt, Ulrich Noethen, Lambert Hamel, Udo Kroschwald, Torsten Michaelis, Axel Werner",Germany,"May 7, 2018",2007,TV-14,91 min,"Comedies, International Movies",Germany's most celebrated actor is commissioned by Nazi propagandist Joseph Goebbels to prepare the leader of the Third Reich to deliver a speech.
s4876,Movie,Anon,Andrew Niccol,"Clive Owen, Amanda Seyfried, Colm Feore, Sonya Walger, Mark O'Brien, Joe Pingue, Iddo Goldberg, Sebastian Pigott, Rachel Roberts, Ethan Tavares","United Kingdom, Canada, United States, Germany","May 4, 2018",2018,TV-MA,100 min,"Dramas, Sci-Fi & Fantasy, Thrillers","In a future where technology has rendered privacy obsolete, a detective investigates a serial assassin who has been deleted from all visual records."
s4877,Movie,Dany Boon: Des Hauts De France,Isabelle Nanty,Dany Boon,France,"May 4, 2018",2018,TV-MA,113 min,Stand-Up Comedy,"In an eclectic one-man show, French superstar Dany Boon reflects on his homeland, his first comedy gig and the challenges of parenting hostile teens."
s4879,Movie,Forgive Us Our Debts,Antonio Morabito,"Marco Giallini, Claudio Santamaria, Jerzy Stuhr, Flonja Kodheli","Italy, Switzerland, Albania, Poland","May 4, 2018",2018,TV-MA,105 min,"Dramas, International Movies","Threatened by creditors, a newly unemployed man agrees to work for a debt collector, but soon discovers his deal with the devil has unexpected costs."
s4884,Movie,Si saben cómo me pongo ¿pá qué me invitan?,Fernando Ayllón,"Ricardo Quevedo, Iván Marín, Freddy Beltrán, Nelson Polanía, Fabiola Posada, Liss Pereira, Jessica Sanjuan, Lina Cardona",Colombia,"May 3, 2018",2018,TV-MA,89 min,"Comedies, International Movies","When four unhappy couples attend a spiritual retreat at a resort to try and solve their relationship troubles, shenanigans ensue."
s4885,Movie,Jailbreak,Jimmy Henderson,"Jean-Paul Ly, Dara Our, Tharoth Sam, Dara Phang, Celine Tran, Savin Phillip, Sok Visal",Cambodia,"May 2, 2018",2017,TV-MA,92 min,"Action & Adventure, International Movies",Four cops escorting a mobster to a high-security prison fight for survival when a gang boss orchestrates a riot from outside to silence their charge.
s4889,Movie,Darc,Julius R. Nasso,"Tony Schiena, Armand Assante, Kippei Shiina, Sho Ikushima, Vienna Hehir, Tetsu Watanabe, Grand Master John U. Kim, Dawn Olivieri",United States,"May 1, 2018",2018,TV-MA,98 min,"Action & Adventure, Independent Movies","To bring down a global human trafficking ring, an Interpol agent recruits the help of a brutal criminal with inside knowledge of the yakuza."
