show_id,type,title,director,cast,country,date_added,release_year,rating,duration,listed_in,description
s8,Movie,Sankofa,Haile Gerima,"Kofi Ghanaba, Oyafunmike Ogunlano, Alexandra Duah, Nick Medley, Mutabaruka, Afemo Omilami, Reggie Carter, Mzuri","United States, Ghana, Burkina Faso, United Kingdom, Germany, Ethiopia","September 24, 2021",1993,TV-MA,125 min,"Dramas, Independent Movies, International Movies","On a photo shoot in Ghana, an American model slips back in time, becomes enslaved on a plantation and bears witness to the agony of her ancestral past."
s10,Movie,The Starling,Theodore Melfi,"Melissa McCarthy, Chris O'Dowd, Kevin Kline, Timothy Olyphant, Daveed Diggs, Skyler Gisondo, Laura Harrier, Rosalind Chao, Kimberly Quinn, Loretta Devine, Ravi Kapoor",United States,"September 24, 2021",2021,PG-13,104 min,"Comedies, Dramas",A woman adjusting to life after a loss contends with a feisty bird that's taken over her garden — and a husband who's struggling to find a way forward.
s13,Movie,Je Suis Karl,Christian Schwochow,"Luna Wedler, Jannis Niewöhner, Milan Peschel, Edin Hasanović, Anna Fialová, Marlon Boess, Victor Boccard, Fleur Geffrier, Aziz Dyab, Mélanie Fouché, Elizaveta Maximová","Germany, Czech Republic","September 23, 2021",2021,TV-MA,127 min,"Dramas, International Movies","After most of her family is murdered in a terrorist bombing, a young woman is unknowingly lured into joining the very group that killed them."
s28,Movie,Grown Ups,Dennis Dugan,"Adam Sandler, Kevin James, Chris Rock, David Spade, Rob Schneider, Salma Hayek, Maria Bello, Maya Rudolph, Colin Quinn, Tim Meadows, Joyce Van Patten",United States,"September 20, 2021",2010,PG-13,103 min,Comedies,"Mourning the loss of their beloved junior high basketball coach, five middle-aged pals reunite at a lake house and rediscover the joys of being a kid."
s42,Movie,Jaws,Steven Spielberg,"Roy Scheider, Robert Shaw, Richard Dreyfuss, Lorraine Gary, Murray Hamilton, Carl Gottlieb, Jeffrey Kramer, Susan Backlinie, Jonathan Filley, Ted Grossman",United States,"September 16, 2021",1975,PG,124 min,"Action & Adventure, Classic Movies, Dramas","When an insatiable great white shark terrorizes Amity Island, a police chief, an oceanographer and a grizzled shark hunter seek to destroy the beast."
s47,Movie,Safe House,Daniel Espinosa,"Denzel Washington, Ryan Reynolds, Vera Farmiga, Brendan Gleeson, Sam Shepard, Rubén Blades, Nora Arnezeder, Robert Patrick, Liam Cunningham, Joel Kinnaman","South Africa, United States, Japan","September 16, 2021",2012,R,115 min,Action & Adventure,Young CIA operative Matt Weston must get a dangerous criminal out of an agency safe house that's come under attack and get him to a securer location.
s82,Movie,Kate,Cedric Nicolas-Troyan,"Mary Elizabeth Winstead, Jun Kunimura, Woody Harrelson, Tadanobu Asano, Miyavi, Michiel Huisman, Miku Martineau",United States,"September 10, 2021",2021,R,106 min,Action & Adventure,"Slipped a fatal poison on her final job, a ruthless assassin working in Tokyo has less than 24 hours to find out who ordered the hit and exact revenge."
s95,Movie,Show Dogs,Raja Gosnell,"Will Arnett, Ludacris, Natasha Lyonne, Stanley Tucci, Jordin Sparks, Gabriel Iglesias, Shaquille O'Neal, Omar Chaparro, Alan Cumming, Andy Beckwith, Delia Sheppard, Kerry Shale","United Kingdom, United States","September 8, 2021",2018,PG,90 min,"Children & Family Movies, Comedies",A rough and tough police dog must go undercover with an FBI agent as a prim and proper pet at a dog show to save a baby panda from an illegal sale.
s108,Movie,A Champion Heart,David de Vos,"Mandy Grace, David de Vos, Donna Rusch, Devan Key, Isabella Mancuso, Ariana Guido",United States,"September 4, 2021",2018,G,90 min,"Children & Family Movies, Dramas","When a grieving teen must work off her debt to a ranch, she cares for a wounded horse that teaches her more about healing than she expected."
s123,Movie,In the Cut,Jane Campion,"Meg Ryan, Mark Ruffalo, Jennifer Jason Leigh, Nick Damici, Sharrieff Pugh, Kevin Bacon, Yaani King Mondschein, Heather Litteer","United Kingdom, Australia, France, United States","September 2, 2021",2003,R,118 min,Thrillers,"After embarking on an affair with the cop probing the murder of a young woman, an insular schoolteacher suspects her lover was involved in the crime."
s132,Movie,Blade Runner: The Final Cut,Ridley Scott,"Harrison Ford, Rutger Hauer, Sean Young, Edward James Olmos, M. Emmet Walsh, Daryl Hannah, William Sanderson, Brion James, Joe Turkel, Joanna Cassidy, James Hong, Morgan Paull",United States,"September 1, 2021",1982,R,117 min,"Action & Adventure, Classic Movies, Cult Movies","In a smog-choked dystopian Los Angeles, blade runner Rick Deckard is called out of retirement to snuff a quartet of escaped ""replicants."""
s134,Movie,Chappie,Neill Blomkamp,"Sharlto Copley, Hugh Jackman, Sigourney Weaver, Dev Patel, Ninja, Yo-Landi Visser, Jose Pablo Cantillo, Brandon Auret, Johnny Selema, Maurice Carpede","South Africa, United States","September 1, 2021",2015,R,121 min,"Action & Adventure, Sci-Fi & Fantasy","In a futuristic society where an indestructible robot police force keeps crime at bay, a lone droid evolves to the next level of artificial intelligence."
s136,Movie,Cliffhanger,Renny Harlin,"Sylvester Stallone, John Lithgow, Michael Rooker, Janine Turner, Rex Linn, Caroline Goodall, Leon, Craig Fairbrass, Ralph Waite, Max Perlich, Paul Winfield","United States, Italy, France, Japan","September 1, 2021",1993,R,113 min,Action & Adventure,"Ranger Gabe Walker and his partner are called to rescue a group of stranded climbers, only to learn the climbers are actually thieving hijackers."
s138,Movie,Crocodile Dundee in Los Angeles,Simon Wincer,"Paul Hogan, Linda Kozlowski, Jere Burns, Jonathan Banks, Aida Turturro, Alec Wilson, Gerry Skilton, Steve Rackman, Serge Cockburn, Paul Rodriguez, Mark Adair-Rios, Tiriel Mora, Grant Piro, Mike Tyson","Australia, United States","September 1, 2021",2001,PG,95 min,"Action & Adventure, Comedies","When Mick ""Crocodile"" Dundee and his family land in Los Angeles, they soon learn some lessons about American life in this comedy sequel."
s140,Movie,Do the Right Thing,Spike Lee,"Danny Aiello, Ossie Davis, Ruby Dee, Richard Edson, Giancarlo Esposito, Spike Lee, Bill Nunn, John Turturro, Paul Benjamin, Frankie Faison, Samuel L. Jackson, Rosie Perez, Martin Lawrence, Miguel Sandoval",United States,"September 1, 2021",1989,R,120 min,"Classic Movies, Comedies, Dramas","On a sweltering day in Brooklyn, simmering racial tensions between residents rise to the surface and ignite rage, violence and tragedy."
s142,Movie,Extraction,Steven C. Miller,"Bruce Willis, Kellan Lutz, Gina Carano, D.B. Sweeney, Joshua Mikel, Steve Coulter, Dan Bilzerian, Heather Johansen","United States, United Kingdom, Canada","September 1, 2021",2015,R,82 min,Action & Adventure,"When a retired CIA agent is kidnapped, his son, a government analyst, embarks on an unauthorized mission to find him and halt a terrorist plot."
s143,Movie,Freedom Writers,Richard LaGravenese,"Hilary Swank, Patrick Dempsey, Scott Glenn, Imelda Staunton, April L. Hernandez, Mario, Kristin Herrera, Jaclyn Ngan, Sergio Montalvo, Jason Finn, Deance Wyatt, Vanetta Smith","Germany, United States","September 1, 2021",2007,PG-13,124 min,Dramas,"While her at-risk students are reading classics such as ""The Diary of Anne Frank,"" a teacher asks them to keep journals about their troubled lives."
s144,Movie,Green Lantern,Martin Campbell,"Ryan Reynolds, Blake Lively, Peter Sarsgaard, Mark Strong, Tim Robbins, Jay O. Sanders, Taika Waititi, Angela Bassett",United States,"September 1, 2021",2011,PG-13,114 min,"Action & Adventure, Sci-Fi & Fantasy",Test pilot Hal Jordan harnesses glowing new powers for good when he wears an otherworldly ring and helps an intergalactic force stop a powerful threat.
s145,Movie,House Party,Reginald Hudlin,"Christopher Reid, Christopher Martin, Robin Harris, Tisha Campbell, A.J. Johnson, Martin Lawrence, Paul Anthony, Bowlegged Lou, B-Fine, Edith Fields, Kelly Jo Minter, Clifton Powell, Verda Bridges",United States,"September 1, 2021",1990,R,104 min,"Comedies, Cult Movies","Grounded by his strict father, Kid risks life and limb to go to his best friend Play's big bash but experiences one obstacle after another."
s150,Movie,I Got the Hook Up,Michael Martin,"Master P, Anthony Johnson, Gretchen Palmer, Frantz Turner, Richard Keats, Joe Estevez, William Knight, Anthony Boswell, Tommy 'Tiny' Lister, Helen Martin, John Witherspoon, Mia X",United States,"September 1, 2021",1998,R,93 min,"Action & Adventure, Comedies","After getting their hands on a misdirected shipment of cell phones, two hustlers try to cash in by hawking the merchandise from the back of their van."
s151,Movie,In Too Deep,Michael Rymer,"Omar Epps, LL Cool J, Nia Long, Stanley Tucci, Pam Grier, Hill Harper, Jake Weber, David Patrick Kelly, Veronica Webb, Ron Canada, Robert LaSardo, Gano Grills, Ivonne Coll, Don Harvey, Mya, Nasir 'Nas' Jones, Jermaine Dupri",United States,"September 1, 2021",1999,R,97 min,Thrillers,"Rookie cop Jeffrey Cole poses as a drug dealer to take down a crime lord and soon gets caught up in an underworld of bribery, intimidation and murder."
s153,Movie,Janoskians: Untold and Untrue,Brett Weiner,"Jai Brooks, Luke Brooks, James Yammouni, Daniel Sahyounie, Beau Brooks",United States,"September 1, 2021",2016,TV-MA,88 min,Comedies,Follow the story of three Australian brothers and their two friends who became an international sensation by posting pranks and gags on YouTube.
s156,Movie,Labyrinth,Jim Henson,"David Bowie, Jennifer Connelly, Frank Oz, Kevin Clash, Anthony Asbury, Dave Goelz, Brian Henson, Ron Mueck, Karen Prell, Shari Weiser","United Kingdom, United States","September 1, 2021",1986,PG,101 min,"Action & Adventure, Children & Family Movies, Cult Movies","In Jim Henson's fantasy, teen Sarah embarks on a life-altering quest to rescue her little brother from the clutches of a treacherous goblin."
s158,Movie,Level 16,Danishka Esterhazy,"Katie Douglas, Celina Martin, Peter Outerbridge, Sara Canning, Alexis Whelan, Amalia Williamson, Josette Halpert, Kiana Madeira",Canada,"September 1, 2021",2018,TV-14,102 min,"Sci-Fi & Fantasy, Thrillers","In a bleak academy that teaches girls the virtues of passivity, two students uncover the ghastly purpose behind their training and resolve to escape."
s160,Movie,Love in a Puff,Pang Ho-cheung,"Miriam Chin Wah Yeung, Shawn Yue, Singh Hartihan Bitto, Isabel Chan, Cheung Tat-ming, Matt Chow, Chui Tien-you, Queenie Chu, Charmaine Fong, Vincent Kok",Hong Kong,"September 1, 2021",2010,TV-MA,103 min,"Comedies, Dramas, International Movies","When the Hong Kong government enacts a ban on smoking cigarettes indoors, the new law drives hard-core smokers outside, facilitating unlikely connections."
s162,Movie,Mars Attacks!,Tim Burton,"Jack Nicholson, Glenn Close, Annette Bening, Pierce Brosnan, Danny DeVito, Martin Short, Sarah Jessica Parker, Michael J. Fox, Rod Steiger, Tom Jones, Lukas Haas, Natalie Portman",United States,"September 1, 2021",1996,PG-13,106 min,"Comedies, Cult Movies, Sci-Fi & Fantasy","As flying saucers head for Earth, the president of the United States prepares to welcome alien visitors but soon learns they're not coming in peace."
s169,Movie,Osmosis Jones,"Bobby Farrelly, Peter Farrelly","Chris Rock, Laurence Fishburne, David Hyde Pierce, Brandy Norwood, William Shatner, Ron Howard, Kid Rock, Ben Stein",United States,"September 1, 2021",2001,PG,95 min,"Action & Adventure, Children & Family Movies, Comedies",Peter and Bobby Farrelly outdo themselves with this partially animated tale about an out-of-shape 40-year-old man who's the host to various organisms.
s268,Movie,The Piano,Jane Campion,"Holly Hunter, Harvey Keitel, Sam Neill, Anna Paquin, Kerry Walker, Genevieve Lemon, Tungia Baker, Ian Mune","New Zealand, Australia, France, United States","August 15, 2021",1993,R,121 min,"Classic Movies, Dramas, Independent Movies","With her daughter and her beloved piano in tow, a mute Scottish woman arrives in New Zealand, where a gruff loner sets out to seduce her."
s271,Movie,Beckett,Ferdinando Cito Filomarino,"John David Washington, Boyd Holbrook, Alicia Vikander, Vicky Krieps, Lena Kitsopoulou, Panos Koronis, Maria Votti","Italy, Brazil, Greece","August 13, 2021",2021,TV-MA,110 min,Action & Adventure,An American tourist goes on the run in Greece after a tragic accident plunges him into a political conspiracy that makes him a target for assassination.
s279,Movie,Lokillo: Nothing's the Same,Julián Gaviria,Lokillo Florez,Colombia,"August 12, 2021",2021,TV-MA,64 min,Stand-Up Comedy,"Through songs and puns, comedian Lokillo Florez hilariously reviews how Latin Americans have adjusted to a new world where no-hugging policies prevail."
s280,Movie,Monster Hunter: Legends of the Guild,Steven Yamamoto,"Ben Rausch, Erica Lindbeck, Dante Basco, Brando Eaton, Stephen Kramer Glickman, Caroline Caliston, G.K. Bowes, Dan McCoy","United States, Japan","August 12, 2021",2021,TV-PG,59 min,"Action & Adventure, Anime Features, Children & Family Movies","In a world where humans and fearsome monsters live in an uneasy balance, young hunter Aiden fights to save his village from destruction by a dragon."
s286,Movie,The Railway Man,Jonathan Teplitzky,"Colin Firth, Nicole Kidman, Jeremy Irvine, Stellan Skarsgård, Sam Reid, Hiroyuki Sanada, Michael MacKenzie, Tom Stokes","Switzerland, United Kingdom, Australia","August 11, 2021",2013,R,108 min,"Dramas, International Movies","Decades after World War II, a still-shattered soldier unexpectedly falls in love and sees a bizarre coincidence bring his past back into focus."
s293,Movie,Quartet,Dustin Hoffman,"Maggie Smith, Tom Courtenay, Billy Connolly, Pauline Collins, Michael Gambon, Andrew Sachs, Sheridan Smith, David Ryall, Trevor Peacock, Gwyneth Jones",United Kingdom,"August 8, 2021",2012,PG-13,98 min,"Comedies, Dramas, Independent Movies","To save their posh retirement home, former opera stars plan a gala recital — until the biggest diva among them refuses to sing."
s296,Movie,The Paper Tigers,Quoc Bao Tran,"Alain Uy, Ron Yuan, Mykel Shannon Jenkins, Jae Suh Park, Matthew Page, Joziah Lagonoy, Raymond Ma",United States,"August 7, 2021",2021,PG-13,111 min,"Action & Adventure, Comedies","After reuniting as middle-aged men, three kung-fu prodigies must set their differences aside and dust off their skills to avenge their beloved mentor."
s309,Movie,American Masters: Inventing David Geffen,Susan Lacy,David Geffen,United States,"August 4, 2021",2012,TV-MA,115 min,Movies,"The son of Jewish immigrants, David Geffen emerged from a humble upbringing to become one of the most powerful media personalities in America."
s326,Movie,Beethoven,Brian Levant,"Charles Grodin, Bonnie Hunt, Dean Jones, Oliver Platt, Stanley Tucci, Nicholle Tom, Christopher Castile, Sarah Rose Karr, David Duchovny, Patricia Heaton, O-Lan Jones, Nancy Fish",United States,"August 1, 2021",1992,PG,87 min,"Children & Family Movies, Comedies","A father reluctantly agrees to let his children keep a St. Bernard puppy, but the playful pooch soon turns into a full-grown engine of destruction."
s328,Movie,Beowulf,Robert Zemeckis,"Ray Winstone, Anthony Hopkins, John Malkovich, Angelina Jolie, Robin Wright, Brendan Gleeson, Crispin Glover, Alison Lohman, Sharisse Baker-Bernard","United States, United Kingdom","August 1, 2021",2007,PG-13,114 min,"Action & Adventure, Sci-Fi & Fantasy",This deftly animated take on a legendary Old English epic tells the timeless tale of a Scandinavian hero who's known for slaying dragons.
s329,Movie,Boyka: Undisputed,Todor Chapkanov,"Scott Adkins, Teodora Duhovnikova, Alon Aboutboul, Julian Vergov, Brahim Achabbakhe, Paul Chahidi, Petio Petkov, Valentin Ganev, Vlado Mihailov","Bulgaria, United States","August 1, 2021",2016,R,90 min,Action & Adventure,The fourth film in the action franchise finds Boyka taking on brutal gangsters to protect the widow of a man he unintentionally killed in the ring.
s330,Movie,Catch Me If You Can,Steven Spielberg,"Leonardo DiCaprio, Tom Hanks, Christopher Walken, Martin Sheen, Nathalie Baye, Amy Adams, James Brolin, Brian Howe, Frank John Hughes, Steve Eastin","United States, Canada","August 1, 2021",2002,PG-13,142 min,Dramas,"An FBI agent makes it his mission to put cunning con man Frank Abagnale Jr. behind bars. But Frank not only eludes capture, he revels in the pursuit."
s331,Movie,Cloudy with a Chance of Meatballs,"Phil Lord, Christopher Miller","Bill Hader, Anna Faris, James Caan, Andy Samberg, Bruce Campbell, Mr. T, Bobb'e J. Thompson, Benjamin Bratt, Neil Patrick Harris, Al Roker","United States, Canada","August 1, 2021",2009,PG,90 min,"Children & Family Movies, Comedies, Sci-Fi & Fantasy","When inventor Flint Lockwood makes clouds rain food, the citizens of Chewandswallow can feed themselves. But a bowl of disaster is about to overflow."
s336,Movie,Freedomland,Joe Roth,"Samuel L. Jackson, Julianne Moore, Edie Falco, Ron Eldard, William Forsythe, Aunjanue Ellis, Anthony Mackie, LaTanya Richardson Jackson, Clarke Peters, Peter Friedman, Domenick Lombardozzi",United States,"August 1, 2021",2006,R,113 min,"Dramas, Thrillers","When a woman reports that her infant son was kidnapped by a black man, an African American detective and a white activist team up to dig for details."
s341,Movie,Inception,Christopher Nolan,"Leonardo DiCaprio, Joseph Gordon-Levitt, Elliot Page, Tom Hardy, Ken Watanabe, Dileep Rao, Cillian Murphy, Tom Berenger, Marion Cotillard, Pete Postlethwaite, Michael Caine, Lukas Haas","United States, United Kingdom","August 1, 2021",2010,PG-13,148 min,"Action & Adventure, Sci-Fi & Fantasy, Thrillers",A troubled thief who extracts secrets from people's dreams takes one last job: leading a dangerous mission to plant an idea in a target's subconscious.
s342,Movie,Magnolia,Paul Thomas Anderson,"John C. Reilly, Philip Baker Hall, Tom Cruise, Julianne Moore, Philip Seymour Hoffman, William H. Macy, Jeremy Blackman, Jason Robards, Melinda Dillon, April Grace, Luis Guzmán, Ricky Jay, Alfred Molina, Michael Murphy, Melora Walters",United States,"August 1, 2021",1999,R,189 min,"Dramas, Independent Movies","Through chance, history and divine intervention, a cast of eclectic characters weaves and warps through each other's lives on a random day in California."
s343,Movie,Major Payne,Nick Castle,"Damon Wayans, Karyn Parsons, William Hickey, Michael Ironside, Albert Hall, Ross Bickell, Orlando Brown, Peyton Chesson-Fohl, Steven Martini",United States,"August 1, 2021",1995,PG-13,97 min,Comedies,A hardened Marine is given his marching orders and must now lead a disorderly group of mismatched cadets into a junior ROTC competition.
s344,Movie,My Girl,Howard Zieff,"Dan Aykroyd, Jamie Lee Curtis, Macaulay Culkin, Anna Chlumsky, Richard Masur, Griffin Dunne, Ann Nelson, Peter Michael Goetz, Jane Hallaren, Anthony R. Jones",United States,"August 1, 2021",1991,PG-13,102 min,Dramas,This coming-of-age charmer follows a summer in the life of an 11-year-old girl who learns about love and loss as she grapples with profound changes.
s345,Movie,My Girl 2,Howard Zieff,"Anna Chlumsky, Austin O'Brien, Dan Aykroyd, Jamie Lee Curtis, Richard Masur, Christine Ebersole, Angeline Ball",United States,"August 1, 2021",1994,PG,99 min,"Children & Family Movies, Comedies, Dramas",A teen makes surprising discoveries when she talks to her dead mother's high school friends for an essay about someone she admires but has never met.
s346,Movie,Open Season: Scared Silly,David Feiss,"William Townsend, Donny Lucas, Melissa Sturm, Trevor Devall, Brian Drummond, Kathleen Barr, Garry Chalk, Lee Tockar, Shannon Chan-Kent, Michelle Murdocca, Lorne Cardinal, Peter Kelamis","United States, Canada","August 1, 2021",2015,PG,85 min,"Children & Family Movies, Comedies","When a spooky werewolf tale scares Boog out of joining the annual camping trip, his friends hatch a plan to cure him of his fear."
s347,Movie,Pineapple Express,David Gordon Green,"Seth Rogen, James Franco, Danny McBride, Kevin Corrigan, Craig Robinson, Gary Cole, Rosie Perez, Ed Begley Jr., Nora Dunn, Amber Heard",United States,"August 1, 2021",2008,R,112 min,"Action & Adventure, Comedies","After witnessing a murder, a perpetually stoned process server and his good-natured dealer go on the run from a drug lord who's out to kill them."
s349,Movie,Poms,Zara Hayes,"Diane Keaton, Jacki Weaver, Pam Grier, Rhea Perlman, Celia Weston, Alisha Boe, Charlie Tahan","United Kingdom, United States","August 1, 2021",2019,PG-13,91 min,Comedies,"After moving to a retirement community, loner Martha befriends a fun-loving neighbor and forms a cheerleading club for young-at-heart seniors."
s350,Movie,Seabiscuit,Gary Ross,"Tobey Maguire, Jeff Bridges, Chris Cooper, Elizabeth Banks, Gary Stevens, William H. Macy, David McCullough, Kingston DuCoeur, Eddie Jones, Ed Lauter, Michael O'Neill, Michael Angarano, Royce D. Applegate, Annie Corley, Valerie Mahaffey",United States,"August 1, 2021",2003,PG-13,141 min,"Dramas, Sports Movies",An ungainly-looking colt becomes a winning thoroughbred in this Depression-era drama based on the true story of champion racehorse Seabiscuit.
s351,Movie,Space Cowboys,Clint Eastwood,"Clint Eastwood, Tommy Lee Jones, Donald Sutherland, James Garner, James Cromwell, Marcia Gay Harden, William Devane, Loren Dean, Courtney B. Vance, Rade Serbedzija, Barbara Babcock, Blair Brown",United States,"August 1, 2021",2000,PG-13,130 min,"Action & Adventure, Dramas, Sci-Fi & Fantasy",A retired engineer agrees to help NASA prevent a Russian satellite from falling to Earth if he and his over-the-hill pals can man the mission.
s355,Movie,The Last Boy Scout,Tony Scott,"Bruce Willis, Damon Wayans, Chelsea Field, Noble Willingham, Taylor Negron, Danielle Harris, Halle Berry, Bruce McGill",United States,"August 1, 2021",1991,R,105 min,"Action & Adventure, Comedies",Private eye Joe Hallenbeck is forced to team up with a disgraced quarterback to uncover a conspiracy by a politician and a football team owner.
s356,Movie,The Lincoln Lawyer,Brad Furman,"Matthew McConaughey, Josh Lucas, Ryan Phillippe, John Leguizamo, Michael Peña, Bryan Cranston, Bob Gunton, William H. Macy, Marisa Tomei, Frances Fisher",United States,"August 1, 2021",2011,R,118 min,"Dramas, Thrillers",A street-wise defense lawyer who operates out of the back seat of his Lincoln lands a high-profile case that soon puts him and his family in danger.
s357,Movie,The Losers,Sylvain White,"Jeffrey Dean Morgan, Zoe Saldana, Chris Evans, Idris Elba, Columbus Short, Óscar Jaenada, Jason Patric, Holt McCallany, Peter Macdissi, Peter Francis James","United States, France","August 1, 2021",2010,PG-13,97 min,Action & Adventure,"After a search-and-destroy mission leads to betrayal, an elite black ops squad seeks revenge. But they must remain deep undercover to even the score."
s359,Movie,The Net,Irwin Winkler,"Sandra Bullock, Jeremy Northam, Dennis Miller, Diane Baker, Wendy Gazelle, Ken Howard, Ray McKinnon, Daniel Schorr, L. Scott Caldwell, Robert Gossett",United States,"August 1, 2021",1995,PG-13,114 min,Thrillers,"A computer analyst becomes a target after she stumbles onto a conspiracy via a mysterious floppy disk, forcing her to go on the run to clear her name."
s360,Movie,The Original Kings of Comedy,Spike Lee,"Steve Harvey, D.L. Hughley, Cedric the Entertainer, Bernie Mac",United States,"August 1, 2021",2000,R,111 min,Stand-Up Comedy,"Comedians Steve Harvey, Cedric the Entertainer, D.L. Hughley and Bernie Mac hit the stage in an iconic stand-up concert directed by Spike Lee."
s366,Movie,Eyes of a Thief,Najwa Najjar,"Khaled Abol El Naga, Souad Massi, Suhail Haddad, Malak Ermileh, Maisa Abd Elhadi, Walid Abdul Salam, Nisreen Faour, Areen Omari",", France, Algeria","July 30, 2021",2014,TV-14,103 min,"Dramas, Independent Movies, International Movies","After a decade in prison, a Palestinian man with a dark secret returns to the West Bank and searches for the daughter he lost long ago."
s393,Movie,Django Unchained,Quentin Tarantino,"Jamie Foxx, Christoph Waltz, Leonardo DiCaprio, Kerry Washington, Samuel L. Jackson, Walton Goggins, Dennis Christopher, James Remar, David Steen, Dana Gourrier, Nichole Galicia, Laura Cayouette, Ato Essandoh, Sammi Rotibi, Escalante Lundy, Don Johnson",United States,"July 24, 2021",2012,R,165 min,"Action & Adventure, Dramas","Accompanied by a German bounty hunter, a freed slave named Django travels across America to free his wife from a sadistic plantation owner."
s427,Movie,Cousins,"Ainsley Gardiner, Briar Grace-Smith","Rachel House, Briar Grace-Smith, Tanea Heke, Tioreore Ngatai-Melbourne, Ana Scotney, Hariata Moriarty, Chelsie Preston Crayford, Sylvia Rands",New Zealand,"July 22, 2021",2021,TV-MA,99 min,Dramas,"Separated as children, three cousins with an unshakeable bond confront their painful pasts and embark on an emotional journey to find each other."
s438,Movie,Cosmic Sin,Edward Drake,"Frank Grillo, Bruce Willis, Brandon Thomas Lee, Corey Large, Perrey Reeves, C.J. Perry, Lochlyn Munro, Costas Mandylor, Adelaide Kane, Eva De Dominici, Sarah May Sommers, Trevor Gretzky",United States,"July 17, 2021",2021,R,88 min,Action & Adventure,"In the year 2524, a disgraced retired general is called back into combat to help prevent an interstellar war against a hostile alien fleet."
s446,Movie,The Beguiled,Sofia Coppola,"Colin Farrell, Nicole Kidman, Kirsten Dunst, Elle Fanning, Oona Laurence, Angourie Rice, Addison Riecke, Emma Howard",United States,"July 16, 2021",2017,R,94 min,"Dramas, Independent Movies, Thrillers","During the Civil War, a wounded Union soldier takes refuge at a Southern girls school, rupturing the calm amid growing sexual tension and infighting."
