show_id,type,title,director,cast,country,date_added,release_year,rating,duration,listed_in,description
s6283,Movie,Beneath the Leaves,Adam Marino,"Mira Sorvino, Kristoffer Polaha, Doug Jones, Paul Sorvino, Aaron Farb, Ser'Darius Blain, Christopher Backus, Christopher Masterson, Tommy Kijas, Kee Seymore, Marla Adams",United States,"June 8, 2019",2019,TV-MA,90 min,"Independent Movies, Thrillers","An escaped psychopathic child killer faces off against one of his former victims, who has since become a hard-nosed detective."
s6284,Movie,Benji: Off the Leash,Joe Camp,"Nick Whitaker, Chris Kendrick, Randall Newsome, Duane Stephens, Lincoln Hoppe, Christy Summerhays, Scott Wilkinson",United States,"March 6, 2018",2004,PG,100 min,"Children & Family Movies, Dramas","Benji is back in this charming story that's told from the pooch's point of view, tracking his early days as a pup to his current life in showbiz."
s6285,Movie,Benji's Very Own Christmas Story,Joe Camp,"Ron Moody, Patsy Garrett, Cynthia Smith",United States,"October 3, 2018",1978,TV-G,25 min,Children & Family Movies,"While on a press tour, Benji goes behind the scenes of Santa's workshop. But Santa has a devastating secret, so it's up to Benji to save Christmas."
s6303,Movie,Big Bear,Joey Kern,"Joey Kern, Adam Brody, Zachary Knighton, Tyler Labine, Pablo Schreiber, Toby Huss, Heidi Heaslet, Ahna O'Reilly",United States,"February 28, 2018",2017,TV-MA,87 min,Comedies,The alcohol-fueled high jinks of a bachelor party go haywire when the buddies of an ill-fated groom abduct his fiancée's new lover.
s6304,Movie,Big Daddy,Dennis Dugan,"Adam Sandler, Joey Lauren Adams, Jon Stewart, Cole Sprouse, Dylan Sprouse, Josh Mostel, Leslie Mann, Allen Covert, Rob Schneider, Kristy Swanson",United States,"October 1, 2020",1999,PG-13,93 min,Comedies,"Dumped by his girlfriend because he refuses to accept responsibility, overgrown adolescent Sonny Koufax adopts a 5-year-old to prove he's a grownup."
s6306,Movie,Big Fat Liar,Shawn Levy,"Frankie Muniz, Paul Giamatti, Amanda Bynes, Amanda Detmer, Donald Faison, Sandra Oh, Russell Hornsby, Michael Bryan French, Christine Tucci, Lee Majors, John Cho","United States, Germany","January 15, 2020",2002,PG,88 min,"Children & Family Movies, Comedies",Junior high students Jason and Kaylee take action when a greedy Hollywood producer turns Jason's essay into a hit film without giving him credit.
s6307,Movie,Big Kill,Scott Martin,"Christoph Sanders, Jason Patric, Clint Glenn Hummel, Lou Diamond Phillips, Danny Trejo, Scott Martin, Elizabeth McLaughlin, Stephanie Beran, K.C. Clyde, Michael Paré",United States,"June 18, 2019",2018,R,126 min,Action & Adventure,A tenderfoot and two gamblers seeking their fortunes in a boom town instead find themselves defending it from a gunslinging preacher and his gang.
s6309,Movie,Bigger Fatter Liar,Ron Oliver,"Ricky Garcia, Jodelle Ferland, Barry Bostwick, Fiona Vroom, Kevin O'Grady, Karen Holness",United States,"April 18, 2017",2017,PG,95 min,"Children & Family Movies, Comedies","When his video game concept is stolen by a dishonest executive, a teenage chronic liar sets out to prove that he's telling the truth, for once."
s6311,Movie,Bill Burr: Let It Go,Shannon Hartman,Bill Burr,United States,"November 10, 2017",2010,NR,65 min,Stand-Up Comedy,"The musings of comedian Bill Burr are let loose in this special, which was filmed at the historic Fillmore Auditorium in San Francisco."
s6312,Movie,Billy Elliot,Stephen Daldry,"Jamie Bell, Gary Lewis, Stuart Wells, Billy Fane, Colin MacLachlan, Nicola Blackwell, Carol McGuigan, Joe Renton, Janine Birkett, Charlie Hardwick, Mike Elliot, Jean Heywood, Jamie Draven, Julie Walters, Trevor Fox, Adam Cooper","United Kingdom, France","February 1, 2019",2000,R,110 min,"Dramas, Independent Movies, International Movies","When a boy trades boxing school for ballet lessons, he may take his newfound talent all the way to the top - and win over his disapproving father."
s6316,Movie,Birthmarked,Emanuel Hoss-Desmarais,"Toni Collette, Matthew Goode, Andreas Apergis, Michael Smiley, Fionnula Flanagan, Suzanne Clément, Jordan Poole, Megan O'Kelly, Anton Gillis-Adelman, Tyrone Benskin, Vincent Hoss-Desmarais",Canada,"June 28, 2018",2018,TV-MA,88 min,"Comedies, Independent Movies, International Movies","In an attempt to settle the ""nature vs. nurture"" debate, a scientist couple raises three children to live lives that defy their genetic dispositions."
s6317,Movie,Bitch,Marianna Palka,"Jason Ritter, Jaime King, Marianna Palka, Brighton Sharbino, Rio Mangini, Jason Maybaum, Kingston Foster, Arielle Kebbel, Martin Starr, Roger Guenveur Smith, Caroline Aaron, Bill Smitrovich",United States,"March 11, 2018",2017,R,97 min,"Comedies, Dramas, Independent Movies","Cracking under the demands of children and a philandering, thankless husband, an overworked suburban mother assumes the persona of a ferocious dog."
s6318,Movie,Bitcoin Heist,Ham Tran,"Kate Nhung, Thanh Pham, Petey Majik Nguyen, Suboi, Jayvee Mai The Hiep, Lam Thanh My",Vietnam,"September 2, 2017",2016,TV-14,116 min,"Action & Adventure, Comedies, International Movies","A unconventional, efficient Interpol special agent goes rogue and assembles a team of thieves to catch a shadowy hacker called ""The Ghost."""
s6326,Movie,Black Panther,Ryan Coogler,"Chadwick Boseman, Michael B. Jordan, Lupita Nyong'o, Danai Gurira, Martin Freeman, Daniel Kaluuya, Letitia Wright, Winston Duke, Sterling K. Brown, Angela Bassett, Forest Whitaker, Andy Serkis, Florence Kasumba, John Kani, David S. Lee, Stan Lee",United States,"September 4, 2018",2018,PG-13,135 min,"Action & Adventure, Sci-Fi & Fantasy","T'Challa, the superpowered new leader of the hidden, highly advanced African nation of Wakanda, strives to protect his home from enemies old and new."
s6327,Movie,Black Site Delta,Jesse Gustafson,"Cam Gigandet, Teri Reeves, Michael Dale, Dion Mucciacito, Casey Hendershot, Benjamin Charles Watson, John Brodsky, Arash Mokhtar",United States,"August 9, 2017",2017,TV-MA,88 min,Action & Adventure,"After discovering that their secret military prison is under attack by terrorists, a ragtag group of inmates does their best to neutralize the enemy."
s6328,Movie,Black Snake Moan,Craig Brewer,"Samuel L. Jackson, Christina Ricci, Justin Timberlake, S. Epatha Merkerson, John Cothran, David Banner, Michael Raymond-James, Adriane Lenox, Kim Richards, Neimus K. Williams",United States,"November 20, 2019",2007,R,116 min,"Dramas, Independent Movies","Lazarus finds Rae beaten and near death, and acts as a father figure to help redeem her. But before saving anyone, Lazarus must face his own demons."
s6331,Movie,Blackway,Daniel Alfredson,"Anthony Hopkins, Julia Stiles, Alexander Ludwig, Ray Liotta, Hal Holbrook, Lochlyn Munro, Steve Bacic, Aaron Pearl, Aleks Paunovic",United States,"December 15, 2017",2015,PG-13,90 min,Thrillers,"Menaced by a psychopath who's got the local cops scared, waitress Lillian turns to a mysterious old logger to help her turn the tables on her stalker."
s6333,Movie,Bleed for This,Ben Younger,"Miles Teller, Aaron Eckhart, Katey Sagal, Ciarán Hinds, Ted Levine, Jordan Gelber, Amanda Clayton, Daniel Sauli, Christine Evangelista, Tina Casciani",United States,"April 11, 2020",2016,R,120 min,"Dramas, Sports Movies","After a devastating injury derails his career, scrappy world champion boxer Vinny Pazienza determines to make an against-all-odds comeback."
s6334,Movie,Blinky Bill: The Movie,Deane Taylor,"Ryan Kwanten, Rufus Sewell, Toni Collette, Robin McLeavy, David Wenham, Barry Humphries, Richard Roxburgh, Deborah Mailman, Barry Otto","Australia, United States","February 8, 2017",2015,PG,91 min,Children & Family Movies,Happy koala Blinky Bill and some spunky pals travel the Outback following clues to help him find his long-lost father and finally bring him home.
s6335,Movie,Blockbuster,July Hygreck,"Syrus Shahidi, Lionel Abelanski, Charlotte Gabris, Tom Hygreck, Sylvain Quimene, Laura Boujenah, Foed Amara",France,"January 24, 2018",2017,TV-MA,85 min,"Comedies, Independent Movies, International Movies","Dumped over a video he made to amuse his ailing dad, a heartsick Jérémy hatches an elaborate scheme to win back his superhero-loving girlfriend, Lola."
s6337,Movie,Blood Father,Jean-François Richet,"Mel Gibson, Erin Moriarty, Diego Luna, Michael Parks, William H. Macy, Miguel Sandoval, Dale Dickey, Richard Cabral, Daniel Moncada, Ryan Dorsey",France,"March 26, 2020",2016,R,88 min,"Action & Adventure, International Movies",An ex-convict and estranged father finds the chance to prove himself when his daughter seeks his help shaking off a dangerous group of drug dealers.
s6338,Movie,Blow,Ted Demme,"Johnny Depp, Penélope Cruz, Franka Potente, Rachel Griffiths, Paul Reubens, Jordi Mollà, Cliff Curtis, Miguel Sandoval, Ethan Suplee, Ray Liotta",United States,"October 1, 2019",2001,R,123 min,Dramas,Cocaine smuggler George rises from poverty to become one of the biggest drug dealers in America before his eventual downfall.
s6340,Movie,Blue Jasmine,Woody Allen,"Cate Blanchett, Sally Hawkins, Alec Baldwin, Louis C.K., Bobby Cannavale, Andrew Dice Clay, Peter Sarsgaard, Michael Stuhlbarg, Tammy Blanchard, Max Casella, Alden Ehrenreich",United States,"March 8, 2019",2013,PG-13,98 min,"Comedies, Dramas, Independent Movies",The high life leads to high anxiety for a fashionable New York City homemaker in crisis who finds herself forced to live a more modest lifestyle.
s6349,Movie,Bob's Broken Sleigh,Jay Surridge,"Cole Howard, Bruce Greenwood, Victor Garber, Michael Adamthwaite, Raini Rodriguez, Colin Murdock, Maryke Hendrikse, Sam Vincent, Gabe Khouth",Canada,"December 17, 2015",2015,TV-G,47 min,Children & Family Movies,"An overly eager elf improves Santa's sleigh, but when he crash lands far from home, three odd critters pitch in to send him back to the North Pole."
s6354,Movie,Bokeh,"Geoffrey Orthwein, Andrew Sullivan","Maika Monroe, Matt O'Leary, Arnar Jónsson, Gunnar Helgason, Berglind Rós Sigurðardóttir","United States, Iceland","June 22, 2017",2017,TV-14,92 min,"Dramas, Independent Movies, Sci-Fi & Fantasy","After learning they are the sole survivors of an eerie apocalypse, a young American couple on vacation in Iceland ponder their love and the future."
s6355,Movie,Bolt,"Byron Howard, Chris Williams","John Travolta, Miley Cyrus, Susie Essman, Mark Walton, Malcolm McDowell, James Lipton, Greg Germann, Diedrich Bader, Nick Swardson, J.P. Manoux, Dan Fogelman, Kari Wahlgren, Chloë Grace Moretz, Randy Savage, Ronn Moss, John DiMaggio, Daran Norris, Jeff Bennett, Brian Stepanek, Todd Cummings",United States,"July 22, 2018",2008,PG,99 min,"Children & Family Movies, Comedies","This tale follows German shepherd Bolt, a canine actor who makes a cross-country trek when he's mistakenly shipped from Hollywood to New York City."
s6357,Movie,Bon Bini Holland,Jelle de Jonge,"Jandino Asporaat, Liliana de Vries, Teun Kuilboer, Sergio IJssel, Dennis Rudge, Alpha Oumar Barry, Phi Nguyen",Netherlands,"September 1, 2016",2015,TV-MA,88 min,"Comedies, International Movies","On the island of Curaçao, an amiable scam artist angers gangsters and flees to Holland, where his conscience is torn between a woman and a new scheme."
s6359,Movie,Bonnie and Clyde,Arthur Penn,"Warren Beatty, Faye Dunaway, Michael J. Pollard, Gene Hackman, Estelle Parsons, Denver Pyle, Dub Taylor, Evans Evans, Gene Wilder",United States,"January 1, 2021",1967,R,111 min,"Action & Adventure, Classic Movies, Dramas","Bonnie Parker and Clyde Barrow are young, in love and on the run during a bullet-riddled bank robbery spree across Depression-ravaged America."
s6413,Movie,Camp X-Ray,Peter Sattler,"Kristen Stewart, Peyman Moaadi, John Carroll Lynch, Lane Garrison, Joseph Julian Soria, Ser'Darius Blain, Cory Michael Smith, Julia Duffy",United States,"January 14, 2017",2014,R,117 min,"Dramas, Independent Movies","Fresh Army recruit Amy Cole is assigned to Guantanamo Bay's Camp X-Ray, where she forms a surprising bond with one of the prisoners in her charge."
s6422,Movie,Caregiver,Chito S. Roño,"Sharon Cuneta, John Estrada, John Manalo, Rica Peralejo, Jhong Hilario, Saul Reichlin, Matthew Rutherford, Claire Jeater, Makisig Morales, Mickey Ferriols",Philippines,"March 5, 2019",2008,TV-14,131 min,"Dramas, International Movies","Sarah leaves her son in the Philippines to reunite with her husband in London, where she struggles personally and professionally as a care-home worker."
s6428,Movie,Casino Royale,Martin Campbell,"Daniel Craig, Judi Dench, Eva Green, Jeffrey Wright, Mads Mikkelsen, Giancarlo Giannini","United Kingdom, Czech Republic, United States, Germany, Bahamas","August 31, 2020",2006,PG-13,145 min,Action & Adventure,"Daniel Craig makes his debut as the newly minted agent 007, who's pitted against an infamous financier of global terrorism – at the poker table."
s6429,Movie,Casino Tycoon,Wong Jing,Wong Jing,Hong Kong,"August 1, 2018",1992,TV-MA,125 min,"Action & Adventure, Dramas, International Movies","When Japanese troops invade Hong Kong, young Benny Ho flees to Macau and rises to the top of the city's casino business with pluck, diligence and wit."
s6430,Movie,Casino Tycoon 2,Wong Jing,Dennis Chan,Hong Kong,"August 16, 2018",1992,TV-MA,108 min,"Action & Adventure, Dramas, International Movies",Casino mogul Benny Ho wields enormous power. But a feud with his former partner and a massive fraud scheme soon threaten his family and his empire.
s6432,Movie,Cat on a Hot Tin Roof,Richard Brooks,"Elizabeth Taylor, Paul Newman, Burl Ives, Jack Carson, Judith Anderson, Madeleine Sherwood, Larry Gates, Vaughn Taylor",United States,"November 1, 2019",1958,NR,108 min,"Classic Movies, Dramas","Members of a Southern clan scramble to curry favor with a dying, wealthy patriarch in this adaptation of Tennessee Williams's sizzling stage drama."
s6434,Movie,Cats & Dogs: The Revenge of Kitty Galore,Brad Peyton,"James Marsden, Nick Nolte, Christina Applegate, Katt Williams, Bette Midler, Neil Patrick Harris, Sean Hayes, Wallace Shawn, Roger Moore, Joe Pantoliano, Michael Clarke Duncan, Chris O'Donnell, Jack McBrayer, Kiernan Shipka","United States, Australia","February 1, 2019",2010,PG,82 min,"Children & Family Movies, Comedies",Cats and dogs must set aside their differences and merge animal instincts when Kitty Galore decides to claw her way to global domination.
s6436,Movie,Cave,Henrik Martin Dahlsbakken,"Heidi Toini, Benjamin Helstad, Mads Sjogard Pettersen, Ingar Helge Gimle",Norway,"June 15, 2017",2016,TV-MA,77 min,"Action & Adventure, International Movies, Thrillers","Torn between old camaraderie and recent tensions, three ex-soldiers reunite to explore a deadly cave but soon discover terror beyond all expectations."
s6438,Movie,Center Stage,Nicholas Hytner,"Amanda Schull, Zoe Saldana, Susan May Pratt, Peter Gallagher, Donna Murphy, Debra Monk, Ethan Stiefel, Sascha Radetsky, Julie Kent, Ilia Kulik",United States,"January 1, 2020",2000,PG-13,116 min,Dramas,"Vying for a spot in the American Ballet Company, 12 dance students are ready to push their bodies and minds to the limit to realize their dreams."
s6442,Movie,Chalay Thay Saath,Umer Adil,"Syra Shehroz, Kent S. Leung, Osama Tahir, Mansha Pasha, Zhalay Sharhadi, Faris Khalid, Behroze Sabzwari, Shamim Hilaly",Pakistan,"May 15, 2018",2017,TV-14,118 min,"Comedies, Dramas, International Movies",Beautiful and adventurous doctor Resham meets a handsome Chinese backpacker named Adam while traveling with friends on a journey of self-discovery.
s6444,Movie,Change in the Air,Dianne Dreyer,"Mary Beth Hurt, Rachel Brosnahan, Aidan Quinn, Olympia Dukakis, M. Emmet Walsh, Peter Gerety, Macy Gray, Satya Bhabha",United States,"March 1, 2020",2018,PG,95 min,Dramas,"When a secretive woman breezes into a quiet town, her subdued neighbors get swept up in curiosity over her ethereal presence."
s6446,Movie,Chappaquiddick,John Curran,"Jason Clarke, Kate Mara, Ed Helms, Bruce Dern, Jim Gaffigan, Olivia Thirlby, Clancy Brown, Taylor Nichols, John Fiore","United States, Sweden","October 1, 2018",2017,PG-13,106 min,Dramas,Senator Ted Kennedy watches his future unravel in the wake of an infamous car crash as family and allies vie to protect his reputation.
s6447,Movie,Charlie and the Chocolate Factory,Tim Burton,"Johnny Depp, Freddie Highmore, David Kelly, Helena Bonham Carter, Noah Taylor, Missi Pyle, James Fox, Deep Roy, Christopher Lee, Adam Godley, AnnaSophia Robb, Julia Winter, Jordan Fry, Philip Wiegratz","United Kingdom, United States","January 1, 2020",2005,PG,115 min,"Children & Family Movies, Comedies",The eccentric Willy Wonka opens the doors of his candy factory to five lucky kids who learn the secrets behind his amazing confections.
s6448,Movie,Charlie's Angels: Full Throttle,McG,"Cameron Diaz, Drew Barrymore, Lucy Liu, Bernie Mac, Crispin Glover, Justin Theroux, Robert Patrick, Demi Moore, Rodrigo Santoro, Shia LaBeouf, Matt LeBlanc, Luke Wilson, John Cleese",United States,"October 1, 2019",2003,PG-13,106 min,"Action & Adventure, Comedies","In this reboot of the TV classic, the Angels are tasked with finding lost rings encoded with the personal information of people in witness protection."
s6449,Movie,Charlotte's Web,"Charles A. Nichols, Iwao Takamoto","Debbie Reynolds, Charles Nelson Reilly, Paul Lynde, Henry Gibson, Rex Allen, Danny Bonaduce, Pamelyn Ferdin, Don Messick, Agnes Moorehead, Martha Scott, John Stephenson, Herb Vigran, Dave Madden",United States,"November 23, 2019",1973,G,94 min,"Children & Family Movies, Classic Movies","Follow the adventures of Wilbur the pig, Templeton the rat and Charlotte the spider in this animated musical version of E.B. White's timeless story."
s6451,Movie,Chasing Amy,Kevin Smith,"Ben Affleck, Joey Lauren Adams, Jason Lee, Dwight Ewell, Jason Mewes, Kevin Smith",United States,"January 1, 2020",1997,R,113 min,"Comedies, Cult Movies, Dramas","Comic book artist Holden meets the perfect woman, only to learn that she's a lesbian. But that doesn't stop him from falling in love with her."
s6467,Movie,Chicken Little,Mark Dindal,"Zach Braff, Joan Cusack, Patrick Stewart, Steve Zahn, Catherine O'Hara, Harry Shearer, Adam West, Don Knotts, Amy Sedaris, Garry Marshall, Patrick Warburton, Fred Willard, Wallace Shawn",United States,"March 16, 2016",2005,G,82 min,"Children & Family Movies, Comedies",No one believes Chicken Little when he tries to warn of an alien invasion – so it's up to him and his misfit friends to save the world!
s6474,Movie,Chitty Chitty Bang Bang,Ken Hughes,"Dick Van Dyke, Sally Ann Howes, Lionel Jeffries, Gert Fröbe, Anna Quayle, Benny Hill, James Robertson Justice, Robert Helpmann, Heather Ripley, Adrian Hall, Barbara Windsor, Davy Kaye, Alexander Doré, Bernard Spear, Stanley Unwin","United Kingdom, United States","January 1, 2020",1968,G,146 min,"Children & Family Movies, Classic Movies, Comedies","Quirky inventor Caractacus Potts and his family travel in their magical flying car to Vulgaria, a kingdom strangely devoid of children."
s6475,Movie,Chloe,Atom Egoyan,"Julianne Moore, Liam Neeson, Amanda Seyfried, Max Thieriot, R.H. Thomson, Nina Dobrev, Laura de Carteret, Mishu Vellani","United States, Canada, France","January 1, 2020",2009,R,96 min,"Independent Movies, Thrillers","Suspecting her husband of infidelity, Catherine hires sexy Chloe to test his faithfulness. Soon, the relationships between all three intensify."
s6481,Movie,Christmas with the Kranks,Joe Roth,"Tim Allen, Jamie Lee Curtis, Dan Aykroyd, Erik Per Sullivan, Cheech Marin, Jake Busey, M. Emmet Walsh, Kevin Chamberlin, Elizabeth Franz, René Lavan",United States,"January 1, 2019",2004,PG,99 min,"Children & Family Movies, Comedies",When Luther Krank and his wife opt to skip Christmas – no tree and no rooftop Frosty – can they handle the fallout from their family and neighbors?
s6482,Movie,Christopher Robin,Marc Forster,"Ewan McGregor, Hayley Atwell, Bronte Carmichael, Mark Gatiss, Jim Cummings, Brad Garrett, Nick Mohammed, Peter Capaldi",United States,"March 5, 2019",2018,PG,104 min,"Children & Family Movies, Comedies, Dramas","Now a careworn middle-aged man, Christopher Robin goes on a familiar adventure when his old pal Winnie the Pooh brings him to the Hundred Acre Wood."
s6494,Movie,Class of '61,Gregory Hoblit,"Christien Anholt, Andre Braugher, Dan Futterman, Josh Lucas, Clive Owen, Sophie Ward, Sue-Ann Leeds, Laura Linney",United States,"April 1, 2018",1993,TV-PG,91 min,Dramas,"As the Civil War looms, a runaway slave seeks freedom, and West Point cadets find their camaraderie shattered as they choose between North or South."
s6495,Movie,Class Rank,Eric Stoltz,"Olivia Holt, Skyler Gisondo, Kristin Chenoweth, Bruce Dern, Nick Krause, Kathleen Chalfant, Peter Maloney, Rod McLachlan, Hawn Tran, Danni Wang",United States,"September 18, 2018",2018,TV-MA,103 min,Comedies,"When her class rank threatens her college plans, an ambitious teen convinces a nerdy peer to run for the school board to abolish the ranking system."
s6497,Movie,Cleopatra Jones,Jack Starrett,"Tamara Dobson, Bernie Casey, BrendaSykes, Esther Rolle, Shelley Winters",United States,"November 1, 2019",1973,PG,89 min,"Action & Adventure, Classic Movies","A stylin' special agent chases down drug lords and does her part to stop trafficking. Soon, she finds herself seeking revenge on a dealer."
s6502,Movie,Cloud Atlas,"Lilly Wachowski, Lana Wachowski, Tom Tykwer","Tom Hanks, Halle Berry, Jim Broadbent, Hugo Weaving, Jim Sturgess, Doona Bae, Ben Whishaw, Keith David, James D'Arcy, Zhou Xun","Germany, United States, Hong Kong, Singapore","August 1, 2017",2012,R,172 min,"Action & Adventure, Cult Movies, Dramas","In this star-studded drama, six seemingly disparate stories explore the complicated links that humanity shares through the generations."
s6503,Movie,Clouds of Sils Maria,Olivier Assayas,"Juliette Binoche, Kristen Stewart, Chloë Grace Moretz, Lars Eidinger, Johnny Flynn, Angela Winkler, Hanns Zischler, Brady Corbet","France, Germany, Switzerland","February 12, 2017",2014,R,124 min,"Dramas, International Movies","A middle-aged actress is cast in a film adaptation of the play that made her famous 20 years earlier, but in a much less glamorous role."
s6511,Movie,Coach Carter,Thomas Carter,"Samuel L. Jackson, Rob Brown, Robert Ri'chard, Rick Gonzalez, Nana Gbewonyo, Antwon Tanner, Channing Tatum, Ashanti, Texas Battle, Denise Dowse, Debbi Morgan","United States, Germany","January 1, 2020",2005,PG-13,137 min,"Dramas, Sports Movies",Controversial basketball coach Ken Carter puts school before sports and benches his undefeated high school team for poor academic performance.
s6512,Movie,Code Name: The Cleaner,Les Mayfield,"Cedric the Entertainer, Lucy Liu, Nicollette Sheridan, Mark Dacascos, Callum Keith Rennie, DeRay Davis, Niecy Nash, Will Patton",United States,"November 1, 2019",2007,PG-13,91 min,"Action & Adventure, Comedies",A mild-mannered janitor duped into believing he's an undercover agent stumbles into an international arms ring plot involving the CIA and the FBI.
s6517,Movie,Colonia,Florian Gallenberger,"Emma Watson, Daniel Brühl, Michael Nyqvist, Richenda Carey, Vicky Krieps, Jeanne Werner, Julian Ovenden, August Zirner, Martin Wuttke, Stefan Merki","Germany, France, Luxembourg, United Kingdom, United States","July 14, 2018",2015,R,110 min,"Dramas, Independent Movies, International Movies","When her boyfriend is caught up in a Chilean coup, a young woman tries to free him from a prison camp posing as a commune by joining it voluntarily."
s6519,Movie,Come and Find Me,Zack Whedon,"Aaron Paul, Annabelle Wallis, Garret Dillahunt, Chris Chalk, Zachary Knighton, Enver Gjokaj, Michael Kopsa, Terry Chen","Canada, United States, United Kingdom","September 18, 2019",2016,R,112 min,"Dramas, Thrillers","When his photographer girlfriend vanishes, an L.A. graphic designer starts his own investigation and uncovers a web of deceit, crime and corruption."
s6524,Movie,Compulsion,Craig Goodwill,"Analeigh Tipton, Jakob Cedergren, Marta Gastini, Jan Bijvoet, Anita Kravos, Valentin Merlet","United Kingdom, Canada, Italy","October 4, 2018",2016,TV-MA,84 min,"Dramas, Thrillers","Lured to a majestic, remote villa by an old lover, an erotic novelist finds herself falling for a mysterious woman and descending into a moral abyss."
s6527,Movie,Concussion,Stacie Passon,"Robin Weigert, Maggie Siff, Johnathan Tchaikovsky, Ben Shenkman, Janel Moloney, Emily Kinney",United States,"August 2, 2018",2013,R,96 min,"Dramas, Independent Movies, LGBTQ Movies","A lesbian housewife, feeling trapped in a stale marriage, begins visiting female prostitutes and soon seeks excitement by becoming a sex worker."
s6534,Movie,Cool Hand Luke,Stuart Rosenberg,"Paul Newman, George Kennedy, J.D. Cannon, Lou Antonio, Robert Drivas, Strother Martin, Jo Van Fleet, Harry Dean Stanton, Dennis Hopper, Joe Don Baker, James Gammon, Wayne Rogers",United States,"January 1, 2021",1967,TV-14,127 min,"Classic Movies, Dramas","Luke Jackson likes to do things his own way, which leads to a world of hurt when he ends up in a prison camp – and on the wrong side of its warden."
s6535,Movie,Cop and a Half: New Recruit,Jon Rosenbaum,"Lou Diamond Phillips, Lulu Wilson, Giles Panton, Janet Kidder, Michael Coleman, Wallace Shawn, Gina Holden, Jordyn Ashley Olson, Vincent Tong, Reese Alexander",Canada,"August 17, 2017",2017,PG,96 min,"Children & Family Movies, Comedies",A world-weary detective is forced to team up with a 12-year-old who thinks she's a cop in order to solve a case that's baffled police.
